문장,극성
필자가 있는 뇌교육융합학과는 인간의 뇌의 올바른 활용과 계발을 습득하는 분야이다,긍정
석유화학 산업은 글로벌 공급 과잉과 중국 성장의 둔화 내수 부진 등으로 1년에 이어 침체 국면이 지속될 것이라는 전망이 많다,긍정
디지털 시대가 가속화되고 있지만 인간 뇌의 구조와 기능은 수십만 년 전 그대로이다,긍정
레이더와 a가 없던 지난 세기까지 이 발명품은 전쟁의 성패를 가를 도구였다,긍정
한편 문학사상사 홈페이지는 1일 오전 1시 현재 트래픽 초과로 홈페이지가 다운됐다,긍정
소득공제 혜택이 있는 연금저축보험은 납입기간 만료 전에 해약할 경우 해약금이 기타 소득으로 인식돼 소득세를 물어야 한다,긍정
맥레이의 고백에는 빠져 있지만 한국에 대한 그의 예측도 완전히 빗나갔다,긍정
지난해 1월말 현재 우리나라 외환보유액 규모는 대만 인도 홍콩 다음으로 세계 1위 수준을 유지하고 있다,긍정
대규모 전쟁을 핵심 재미 요소로 내세운 게임으로 침략자이자 지배자인 엘프와 이에 맞서는 인간 영웅 스탠더 이들을 둘러싼 인간군상의 이야기를 담았다,긍정
1개 팀을 1개 그룹으로 구성해 그룹별 1위를 기록한 팀 중 추첨을 통해 1만 원 상당의 기프트 박스와 1만 게임 머니 등을 1명에게 선물한다,긍정
이와관련해 국내 보건당국은 병원체 감염이 엄마에게서 아기로 직접 옮기는 수직감염 가능성이 거의 없을 것이라는 입장을 내놨다,긍정
연구팀은 이번 연구를 통해 빙하 속 동결 보존된 바이러스를 손상 없이 온전히 꺼낼 수 있는 방법을 확인할 수 있었다고 밝혔습니다,긍정
그런데 말이다,긍정
이용자 의견 수립에도 힘쓴다,긍정
매우 부적절과 부적절이 각각 1 1였고 적절과 매우 적절은 각각 1 1에 그쳤다,긍정
이 외에도 대규모 전쟁 콘텐츠 방파 리그전 천지풍운과 새로운 항해 콘텐츠 천룡성 머리염색 기능 신규 신병 대비부와 목엽비도도 더했다,긍정
커뮤니티 설정 기능도 빼놓을 수 없는 사용자 결정권의 핵심 요소다,긍정
이에 정부와 화물연대 양측은 전일 1차 실무대화를 통해 안전운임제 연장후속 논의를 골자로 합의안을 도출했다,긍정
기생충은 가장 강력한 경쟁자였던 샘 맨데스 감독의 1를 필두로 아이리시맨마틴 스코세이지  조조 래빗타이카 와이티티  조커토드 필립스 작은 아씨들그레타 거위그결혼 이야기노아 바움백 원스 어폰 어 타임인 할리우드쿠엔틴 타란티노 등 쟁쟁한 경쟁작들을 제치고 작품상 수상자로 호명됐다,긍정
레이더는 전자기파로 주변 영역을 감시하고 표적을 탐지 및 추적해 표적까지의 거리 각도 고도 속도 등의 정보를 획득하는 전천후 센서이다,긍정
대마도는 땅이 척박해 우리나라에서 쌀을 얻어먹어야 했기 때문이다,긍정
물리적 충돌은 없었으나 공장 정문 1개 차로 중 1개 차로를 노조 측이 화물차로 막아놓은 상태였다,긍정
이두섭 직방 이사는 촬영 중인 본인 얼굴이나 대화 내용은 절대 저장되지 않는다 그럴 일도 없겠지만 1시간 돌아가는 소마월드 데이터를 일일이 저장하려면 천문학적인 서버 비용이 들어갈 테다 전혀 걱정하지 않아도 될 부분이라고 설명했다,긍정
그는 대한민국은 문재인 대통령의 사람들 것이 아니다라고 강조했다,긍정
누적 투자 금액은 각각 1억원1 1억원1 1억원1에 달한다,긍정
그러자 서부의 총잡이들이 살롱의 문을 열고 들어선다,긍정
추가 공격력과 치명타 레벨을 확보가 가능하다,긍정
인조는 일개 승려였던 그에게 시까지 지어주면서 곁에 두려고 했다,긍정
아직 미국에 인종차별 정책이 존재하던 시기에 태어난 쌍둥이 자매가 주축이 되어 1년대부터 1년대까지 수십 년을 오가며 펼쳐지는 장대한 이야기 속에는 사회가 정한 규칙과 규범에 때로는 적응하고 때로는 저항하며 치열하게 자신의 삶을 개척하는 생생하고 다양한 인물들이 등장한다,긍정
작은 개체들이 힘을 합치고 협력하면서 규모를 키울 때만 가능하다,긍정
a생명은 지난해 마무리를 목표로 매각을 진행했으나 진행과정이 해를 넘기면서 차일피일 미뤄지는 모습이다,긍정
아시안스윙 1개 대회 취소는 박인비의 계획에 차질을 주었을 게 분명하다,긍정
화가 이녕은 중국 황제 중 가장 뛰어난 예술적 재능을 가졌던 송나라 제1대 휘종을 놀라게 한 솜씨를 지녔지만 오늘날에는 그 흔적을 찾기 어려운 잊혀진 대가다,긍정
공민왕은 수많은 그림을 남겼는데 특히 초상화를 잘 그렸다,긍정
이날 행사에서는 컴투스홀딩스대표 이용국의 a 본부 사업1실 이종석 실장과 크래프톤의 자회사 라이징윙스대표 김정훈의 최수영 a가 강연에 나서 자신들이 준비 중인 a 및 블록체인 프로젝트를 소개한다,긍정
재미동포인 그에 대한 안 좋은 선입관까지 겹치며 1집 이후 결국 한국을 떠나야 했다,긍정
이는 아보카도의 비타민a 덕분으로 아보카도 1a에는 비타민a가 일일 섭취 권장량의 1가 들어 있다,긍정
이기의 송와잡설에 따르면 왜란이 발발한 이래로 과거를 통과한 이가 수만 명이었는데 그중에는 사족 한량은 말할 것도 없고 서얼이나 천민 백정까지 참여하지 않은 자가 없었다,긍정
심리불속행이란 원심에 중대한 법령 위반 등 특별한 사유가 없는 경우 본안 심리 없이 상고를 기각하는 제도다,긍정
성윤모 산업부 장관은 신년사를 통해 1분기 중 수출을 조기에 플러스로 전환하는 것을 목표로 총력 대응 체계를 가동하고 있다고 자신감을 보였다,긍정
김 지사장은 a 로봇이 사내에 내재화돼 디지털 전환이 일어나려면 경영진의 리더십이 중요하다고 강조했다,긍정
인덕원숲속마을1단지 전용 1 역시 1억1만원에 거래돼 지난해 1월 최고가 1억원보다 1억원 넘게 하락했다,긍정
라오니치는 올해 호주 오픈에서 서브에이스를 1개 기록하며 닉 키리오스1위 호주와 함께 가장 많은 에이스를 기록한 선수다,긍정
그러면서 성상왕의 크고 깊은 덕이 아니면 제 놈이덕형이 어찌 감히 천지간에 용납되오리까라고 했다,긍정
최근 비트코인 가격이 급락하는 것은 미국 연방준비제도이사회a의 1월 공개시장위원회a 정례회의를 앞두고 기준금리 대폭 인상 가능성이 부각되고 있기 때문이다,긍정
1일 통계청이 발표한 소비자물가 동향에 따르면 1월 소비자물가지수는 111년1로 전년 동월 대비 11 상승했다,긍정
소비자 물가지수 발표 이후 월가의 바클레이즈와 제프리즈 투자은행은 모두 1월 물가 상승률 발표 이후 연준이 금리를 11포인트 올릴 것으로 전망했다,긍정
이랜드이츠의 대표 뷔페 브랜드 애슐리의 1여 개 메뉴를 개발해 애슐리 확산에 핵심 역할을 했고 리뉴얼 매장인 애슐리퀸즈의 1여 개 메뉴 개발을 담당해 해당 점포들은 1가 넘는 성장세를 이뤘다,긍정
1년 한 지자체가 해당 부동산을 수용하면서 a씨 몫 보상금 1억1만원을 공탁했다,긍정
상황이 이러하니 수령들은 임기가 끝났을 때 백성들이 유임시켜 달라고 나라에 청하는 것이 드물어 큰 영광으로 여겼다,긍정
시진핑 중국 국가주석이 올해 한국을 방문해도 상황은 바뀔 게 없다고 강조했다,긍정
미래 신산업에 선제적으로 투자해서 경제 활력도 다시 불어넣어야 할 때다,긍정
성균관대 기계공학과를 졸업한 그는 1년부터 1년까지 현대자동차 생산기술연구소 연구원으로 일했다,긍정
혹시나 모를 위험에 대비하는 것은 중요하다,긍정
인천 옹진군 소재 갯벌에 차량이 빠지는 사고가 또 발생했다,긍정
이러한 이유로 서소문 밖 네거리는 조선시대 국가 공식 참형지가 되었다,긍정
가동을 중지했다가 재개하는 데만 최대 1주일이 걸린다,긍정
충북반도체고의 경우 취업률이 11일 정도로 반도체 특성화고는 다른 특성화고나 일반고보다 뛰어난 취업 성과를 보이고 있지만 막상 학생의 진학 선호도가 낮은 탓이다,긍정
린이푸 베이징대 교수는 지난해 1월 세계지식포럼에서 니얼 퍼거슨 하버드대 교수와 맞짱 토론을 통해 중국이 패권싸움에서 승자가 될 것이라고 자신했다,긍정
예컨대 기후변화 코로나바이러스 등 환경변화에 따른 신종위험에 대응한 민간보험산업의 대응과 상품 및 채널 구조 개선과 관련해 디지털 혁신과 모럴 해저드에 대해 연구할 계획이라고 소개했다,긍정
마지막 옵션 거래일은 1일로 이날 1계약a이 체결됐다,긍정
평소 물에 만 밥 한 그릇과 마른 생선 생강 조린 것 김치와 간장이 고작이었다,긍정
콘크리에프엔비는 사명 변경 이후 콘크리 계열사로 편입돼 식음료 분야를 전담한다,긍정
어린 시절 외갓집에 놀러간 적이 있었다,긍정
영화는 호르헤 마리오 베르골리오프란치스코 교황의 본명 추기경이 로마 교황청에 사직서를 제출하면서 시작한다,긍정
하 대표부터가 태생이 엔지니어다,긍정
이에 따라 컴투스는 국제구호개발 a 세이브더칠드런코리아이사장 오준를 통해 신생아들의 건강한 출산과 성장을 지원하는 산모 출산 준비 키트 1개와 감염병에 노출되기 쉬운 신생아들을 보호하기 위한 필수 약품 키트 1개를 기부하게 됐다,긍정
우리는 정보의 내용에 있어서 사실을 근거한 명확한 사실인지 대한 확인도 없이 전달된 내용을 때로는 그대로 받아들이고 있다,긍정
하지만 기존 팬들과 운영자 간에 마찰이 발생했고 양준일 본인 역시 이미 판타자이를 탈퇴한 것으로 전해졌다,긍정
국고채 1년물과 연동되는 금융채 1년물 금리도 상승이 불가피한 상황이다,긍정
엄 씨가 대궐로 들어오자 장안 사람들은 모두 고종이 명성황후의 죽음을 슬퍼하지 않는다며 한스럽게 생각했다,긍정
또 학위를 취득한 후 해외에서 1년 이상 연구기술개발 경험을 가진 내국인 우수 인력이 국내 연구기관 등에 취업하면 1년 동안 소득세의 1를 감면한다,긍정
싱가포르는 1개 주식당 1싱가포르달러로 통용되기 때문에 우리는 합리적인 결론을 다음과 같이 추론할 수 있습니다,긍정
지난해 1월엔 한국영화사상 최초로 칸 영화제 대상인 황금종려상을 차지하는 기염을 토했다,긍정
가스업종에서는 한국가스공사가 고유가 수혜주로 꼽힌다,긍정
아에르라는 브랜드가 이름을 날린 건 최근이지만 사실 씨앤투스성진의 필터 업력은 1년 가까이 된다,긍정
최초의 a1a 마스크 브랜드인 아에르가 탄생한 배경이다,긍정
두 번째는 스트렝스존으로 티타늄 소재를 채용한 a바가 강한 충격을 견디고 무게감을 형성하도록 도와준다,긍정
1월 1일 1차 1일 1차 1일 1차 1일 1차에 걸쳐 의견을 좁혀 잠정합의안을 도출했으며 1월 1일과 1일 양일간 웹젠 조합원 투표를 진행해 가결했다,긍정
합계출산률이 1 대로 떨어졌고 자연출산률도 1로 당장 올해부터는 인구감소가 시작 될 위기인데 안건이 없어 회의가 열리지 못했다는 설명은 이해가 어려운 상황이다,긍정
휴일이면 자동차를 자가 정비하는 모습을 동네 곳곳에서 쉽게 볼 수 있다,긍정
최근 인기 여행지인 영국 런던 소재의 기념품 가게에서 카드 소액 결제를 통한 사기 행각이 기승을 부리고 있어 여행객들의 각별한 주의가 요구되고 있다,긍정
아시아 여자 축구 강국인 북한a 랭킹 1위이 도쿄올림픽에 출전하지 않기로 하면서 다음달 열리는 최종 예선에서 같은 a조의 미얀마와 베트남을 상대로 잘 싸워 조 1위를 확보하는 게 1차 목표다,긍정
두 게임은 위메이드트리의 블록체인 게임 플랫폼 위믹스a를 통해 1년 상반기와 하반기에 각각 서비스될 예정이다,긍정
가게는 아침 1시쯤에 문을 연다,긍정
연금 선진국인 미국과 호주 영국 등은 일찌감치 디폴트 옵션을 적용했죠,긍정
관련본지는 1월 1일자 위 제목의 칼럼에서 김경율 회계사가 조국 펀드의 불법성을 주장했다는 이유로 참여연대의 비판을 받더니 결국 참여연대를 등지고 나왔다고 보도했습니다,긍정
삼성교통안전문화연구소도 최근 음주운전 재범실태 및 음주 시동 잠금장치 도입 필요성에 대한 보고서를 발표했다,긍정
전세대출 원리금 상환액 소득공제율은 현행 1에서 1로 상향하고 현재 11인 월세 세액공제율을 최대 1로 확대하는 방안이 거론되고 있다,긍정
업계 관계자는 지름 1는 정해졌지만 길이총고는 고객사와 협의 중이라고 말했다,긍정
a1 드라이버는 a투어의 스윙 임팩트를 분석해 만든 a a 설계를 더해 반발 영역을 최대로 만든 제품이다,긍정
한국 영화는 지난 1년 신상옥 감독의 사랑방 손님과 어머니 출품을 시작으로 꾸준히 아카데미상에 도전했지만 후보에 지명된 것도 수상에 성공한 것도 이번이 처음이다,긍정
미사키는 강 속성의 a급 마법 보조 신기사다,긍정
국내 민간 최초로 추력 1a급 하이브리드 로켓엔진을 사용하는 소형 위성 발사체 한빛을 개발 중이다,긍정
정부의 규제 샌드박스를 통해 시범사업을 하고 있지만 현장을 통제하는 요원은 운전면허증을 소지해야 한다는 규정이 적용돼 예상 밖의 추가 비용도 들어가고 있는 실정이다,긍정
이들에게 하지 말라고 얘기할 수 있어야 한다,긍정
파타고니아 안티 쇼핑 캠페인은 1년으로 거슬러 올라간다,긍정
신동덤은 신비한 동물사전과 해리 포터 시리즈를 잇는 마법 어드벤처물로 전편에 이어 데이비드 예이츠가 연출하고 원작자인 aa 롤링이 각본을 썼다,긍정
콜오브듀티 월드오브워크래프트 기타히어로 a 히어로 마블 스트라이크 포스 스카이랜더스 등의 대작 게임을 개발한 베테랑들이 설립했으며 사용자 소유 경제에 기반한 게임 개발에 특화됐다,긍정
영양치료에 처방되는 비타민 a는 당근과 같은 채소나 산야초 해초류등에 들어있는 성분과 동일한 성분이다,긍정
박종석 한은 부총재보는 지난 1일 기자간담회에서 자본 유출입은 대외 금리차의 영향도 받지만 대외 건전성이나 펀더멘탈경제 기초체력에 더 크게 영향을 받는다고 전했다,긍정
대표적으로 베타시토스테롤 함량이 높아지는데 베타시토스테롤은 앞서 나온 좋은 콜레스테롤인 a 콜레스테롤을 흡수해 버린다,긍정
새로운 블록체인 기반 게임 a 프로젝트도 공개했다,긍정
최강 연맹전에 참여 또는 관전하기 위해서는 국가 대전 건물이 필요하다,긍정
신용카드 매출 감소액 등 증빙서류를 갖추고 먼저 신청하도록 하는 방법도 있을 것이다,긍정
정부가 비트코인 등에 투자하는 국민이 늘어난 세태를 반영해 1년 뒤 가구별 가상자산 현황을 공표하는 방안을 추진한다,긍정
프라이팬 1위 기업에서 주방 가전 등으로 사업을 확장해온 a컴퍼니는 이런 변화의 바람을 a a에 담았다,긍정
콘진원은 게임개발 이외 인력이 부족한 중소게임사를 돕고자 게임 전담 a을 배정해 해외진출 경험이 없더라도 해외에 게임을 출시할 수 있도록 전략 컨설팅을 기본적으로 제공할 예정이다,긍정
바람 부는 육교 위에서 아사코가라타 에리카는 바쿠히가시데 마사히로에게 첫눈에 반하고 두 사람은 연인이 된다,긍정
보험료는 남자 1세 기준 최저 1원대 중반이다,긍정
이어 원칙적으로 공공기관 및 지자체는 경영 효율화 등을 통해 원가 상승 요인을 최대한 흡수할 것이라고 덧붙였다,긍정
만민이 기뻐하더라도 그중에 누군가는 원망하는 자가 있을 것이니 세워서 욕을 먹을 바에야 세우지 않음만 못할 것이다,긍정
이를 위해 양한방 통합 암치료에 대한 연구 활동을 이어오고 있다,긍정
다만 안전장치를 마련해야 한다는 신중론도 나온다,긍정
특히 노리치시티와 11로 비기고 사우샘프턴에는 11로 패하며 최근 1경기 무승에 빠졌다,긍정
로봇은 직원들이 답변한 데이터를 취합하고 결과에 따라 직원 상태를 주의단계노란색 경계단계주황색 심각단계빨간색로 나눠서 일목요연하게 보여준다,긍정
조선의 제1대 왕 성종도 술을 즐기고 놀기를 좋아했다,긍정
연세대 학생회관은 한국 현대사의 주요 국면에 강렬한 실천적 공간이 된다,긍정
단일 단지로는 역대 최대 규모다,긍정
사람들의 사고도 달라질 것이다,긍정
용재총화에 따르면 성종 1년1에 유구국 사신이 방문해 임금이 경회루 밑에서 접견했다,긍정
스페인 거장 페드로 알모도바르가 찍은 페인 앤 글로리 와 프랑스 타오르는 여인의 초상등 동부문의 쟁쟁한 경쟁작을 제치고거둔 성과다,긍정
이는 오히려 성공하는 게임보다 실패하는 게임이 늘어나는 현상으로 이어졌다,긍정
동시에 각 캐릭터마다 슈팅 플레이를 보완하는 독특한 스킬을 마련해 전략 플레이 요소를 가미하여 기존 장르 게임의 경험을 확장했다며 신작을 통해 전 세계 a 팬과 새롭게 만나기를 고대하고 있다고 밝혔다,긍정
당산현대1차 재건축 추진준비위원회 관계자는 인근에 재건축을 추진하는 단지가 많다 보니 사업에 대한 주민 관심이 높아 며칠 만에 동의율 1를 달성했다며 예비안전진단 신청 요건을 확보했으니 추후 안전진단 규제 완화 추이를 지켜보면서 적당한 시점에 신청서를 접수할 계획이라고 설명했다,긍정
이어 a 수량이 많다 보니 선택과 집중으로 필요한 곳에 좀 더 공을 들였다라며 메인급 a들은 a급의 스펙 및 커스터마이징으로 제작을 했고 일반 a도 폴리곤 수는 줄였지만 스캔 데이터를 적극 활용해 제작했다라고 덧붙였다,긍정
이는 국내 게임업계 최초의 파업 결정으로 주목을 받았다,긍정
이 설문은 오는 1일까지 진행될 예정으로 참여자는 실시간으로 늘어나고 있다,긍정
앞서 지난 1년 밀양으로 칸영화제에서 여우주연상을 받은 전도연은 칸의 여왕이라는 수식어를 얻었다,긍정
고강도 긴축 대응이 예상되면서 경기 침체에 대한 우려도 확산되고 있다,긍정
1년 만의 큰 변화다,긍정
그런데 왕조국가였던 조선에서는 이런 일이 비일비재했다,긍정
그는 친노조 성향 정책이 반복되며 일자리를 지킨 사람들은 계속 혜택이 추가된다 이들은 주로 중위소득 근방에 위치한 계층이라며 반면 소득주도성장 정책으로 일자리를 잃은 가구들은 점점 생계가 어려워지고 있는데 중산층 하한 기준을 소득 1에서 1로 올려 잡으면 이런 계층이 누락돼 중산층 지표가 개선되는 것처럼 착시를 일으킨다고 설명했다,긍정
이로써 클럽 헤드의 불필요한 움직임을 1 감소시켜 전작 대비 1야드 정도 비거리를 향상시킬 수 있었다고 한다,긍정
전통술 제조의 대가이자 부친인 고 배상면 국순당 창업주의 우곡주 제조 비법을 전수받았지만 1년째 이렇다 할 성과를 내지 못한 게 늘 마음에 걸렸다,긍정
벌거벗은 여자를 감추는 게 과연 어렵소이다라고 이항복이 능청스럽게 웃자 권율도 할 말을 잃은 채 따라 웃고 말았다,긍정
당초 예정된 1일 오전 1시보다 이틀 이른 출시다,긍정
세계국가편람은 1년 국내 최초로 발간된 이래 매년 정부와 수출기업 금융기관 등이 대외경제협력과 해외시장 진출 전략을 수립하는데 나침반 역할을 하고 있다,긍정
최수종은 너무 편한 친구들과 함께해서 일하는 기분보다는 하루 여행가는 기분으로 촬영하고 있다고 했다,긍정
여섯째 만나는 사람들과 자신의 비전을 공유한다,긍정
이러한 사회적 요구에 발맞춰 많은 기업이 a 핵심 관리지표와 연계해 개인정보 보호 체계를 강화하고자 진력을 다하고 있다,긍정
a씨는 요금을 받기 전 a군에게 남자 아니냐고 묻기도 했다,긍정
공군 측은 지난 1년 레밀리터리블을 공개한 이후 가수 김진표의 노래 아저씨를 패러디한 뮤직비디오 군인 아저씨 영화 보헤미안 랩소디를 패러디한 입대하는 랩소디 등 유쾌한 영상을 연이어 제작하며 공군 입대 독려에 공을 들이고 있다,긍정
선진국은 1년대 초부터 1세기를 뇌의 세기로 선포하고 대형 선도 프로젝트를 통해 인간 뇌에 관한 근원적 이해에 일찌감치 뛰어들었다,긍정
재판부는 고령자 고용촉진법은 정년 연장에 따라 임금 체계를 개편할 것을 주문하고 있고 이는 국회의 법 개정 과정 회의록에도 나타난다며 여기에는 임금 삭감도 포함된다고 밝혔다,긍정
한사경은 좌의정 신숙주가 노산군단종의 부인정순왕후을 자신에게 노비로 달라고 주청했으나 세조는 이를 윤허하지 않았다 논하여 말하노니 세조가 조카를 죽이고 여러 아우를 살해하여 임금의 지위를 훔친 것은 영원히 남을 큰 죄악이다 그러나 신숙주가 단종의 비를 달라고 청한 것은 간악한 것 중에서도 더욱 심한 것이다 비록 신숙주의 후손이 후대에 걸쳐 창성하였다고 하지만 그의 악명이 천지와 함께 존속되어서 큰 강과 바다로도 씻을 수 없으니 음란한 자에게 화를 준다는 천도의 진리가 틀렸다고 말할 수 있을 것인가라고 썼다,긍정
배터리는 완충 시 1시간 작동하며 케이스를 사용하면 최대 1시간까지 연속 재생된다,긍정
법무부가 경제위기 상황에 능동적으로 대처하기 위해 경제와 직결되는 정책을 경제 부처와 공동 추진한다,긍정
싸이 측은 흠뻑쇼 관객에게 개인 방역 마스크를 지참하게 하고 방수 마스크를 추가 지급해 방역에 만전을 기하기로 했다,긍정
해당 연령의 유행 상황과 중증화율 백신의 효과성과 안전성도 검토 대상이다,긍정
최근 나온 매물은 호가가 대부분 1억1억1만원에 형성됐다,긍정
엔진이 열을 받기 전인 냉간 시 또는 추운 겨울철에 배기가스가 백색으로 발생할 때는 응결수나 기온 차로 나타나는 수축 현상으로 정상적이다,긍정
올겨울 추위가 심할 경우 전력 예비율 1를 맞추는 데 1만가구분의 전력이 부족할 것이라는 예측이 나오는 등 전력난 해소를 위해 화력발전소원전 재가동에 나서야 한다는 목소리가 나온다,긍정
현재 금리 수준이 유지된다는 가정하에 산출한 예상 손실액은 1억원으로 손실률이 11에 달한다,긍정
이착륙 활주로와 시설이 잘 갖춰진 공항에서 화물 탑재가 이루어지는 상용 화물기는 대부분 여객기를 개조하여 제작하지만 유사시 작전지역이 비포장 환경에서 이착륙과 화물 탑재가 이루어지는 수송기는 보다 더 튼튼한 랜딩기어와 탑재 장비 없이 화물 이동을 위한 낮은 후방 램프도어 그리고 주 날개와 꼬리 날개는 고익 형상으로 설계 제작된다,긍정
퇴직 후 중산층이 저소득층으로 전락하지 않도록 연금 개혁도 반드시 이뤄져야 한다,긍정
1 안전하고 큰 회사여서 위험률이 제로1라는 말을 듣고 투자했다는 내용 등이다,긍정
게임빌은 지난 1년 1월 1일 창립한 모바일게임 전문기업이다,긍정
국내 첫 출시는 크라우드 펀딩 플래폼 와디즈를 통해 이뤄지며 펀딩 오픈 시기는 오는 1일 오후 1시다,긍정
봉 감독은 아카데미와 칸 이전인 작년 재작년부터 준비한 프로젝트가 있었고 변함없이 준비하고 있다 시나리오를 조금씩 쓰고 있다고 전했다,긍정
내 생각이 옳고 상대가 틀렸다는 걸 확인하니 절로 기분이 좋아진다,긍정
이어 어제 있었던 나쁜 예시에 대해 사과한다고 미안함을 전했다,긍정
