문장,극성
분위기만으로 것이라는 사라질 유령이 설익은 기대는 금물이다,부정
이런 사라질 설익은 것이라는 기대는 금물이다,부정
사라질 것이라는 기대는 설익은 금물이다,부정
이런 분위기만으로 설익은 것이라는 사라질 기대는 금물이다,부정
하지만 이런 분위기만으로 유령이 것이라는 사라질 설익은 기대는 금물이다,부정
유령이 사라질 설익은 것이라는 기대는 금물이다,부정
분위기만으로 사라질 것이라는 기대는 설익은 금물이다,부정
하지만 이런 유령이 설익은 것이라는 사라질 기대는 금물이다,부정
이런 분위기만으로 유령이 기대는 것이라는 설익은 사라질 금물이다,부정
현대1차뿐 아니다,부정
기생충은 이날 후보에도 감독상 각본상과 이름을 올렸으나 연결되지는 않았다,부정
기생충은 각본상과 이날 감독상 후보에도 이름을 올렸으나 연결되지는 않았다,부정
기생충은 이날 각본상과 감독상 수상으로 이름을 올렸으나 후보에도 연결되지는 않았다,부정
기생충은 후보에도 각본상과 감독상 이날 이름을 올렸으나 연결되지는 않았다,부정
기생충은 이날 각본상과 감독상 연결되지는 이름을 올렸으나 후보에도 않았다,부정
기생충은 이날 올렸으나 감독상 후보에도 이름을 각본상과 연결되지는 않았다,부정
기생충은 이날 이름을 감독상 후보에도 각본상과 올렸으나 수상으로 연결되지는 않았다,부정
기생충은 이날 각본상과 이름을 후보에도 감독상 올렸으나 연결되지는 않았다,부정
주춧돌과 기왓장만 남아 결국 도솔암은 년 전부터 뜻있는 스님들의 복원 시도가 있었으나 있던 뜻을 이루지 못했다,부정
주춧돌과 이루지 남아 있던 도솔암은 지금으로부터 뜻있는 스님들의 복원 시도가 있었으나 그 뜻을 기왓장만 못했다,부정
주춧돌과 있던 남아 기왓장만 도솔암은 뜻있는 스님들의 복원 시도가 있었으나 결국 뜻을 이루지 못했다,부정
주춧돌과 기왓장만 남아 있던 있었으나 뜻있는 스님들의 복원 시도가 도솔암은 그 뜻을 이루지 못했다,부정
주춧돌과 기왓장만 스님들의 있던 도솔암은 1여 뜻있는 남아 복원 시도가 있었으나 그 뜻을 이루지 못했다,부정
주춧돌과 기왓장만 남아 있던 1여 도솔암은 년 뜻있는 스님들의 복원 시도가 있었으나 뜻을 이루지 못했다,부정
주춧돌과 기왓장만 남아 있던 도솔암은 지금으로부터 시도가 전부터 뜻있는 스님들의 복원 년 있었으나 그 뜻을 이루지 못했다,부정
주춧돌과 기왓장만 뜻을 있던 도솔암은 지금으로부터 뜻있는 스님들의 복원 시도가 있었으나 남아 이루지 못했다,부정
주춧돌과 기왓장만 남아 있던 도솔암은 약 1여 뜻있는 스님들의 결국 시도가 있었으나 복원 그 뜻을 이루지 못했다,부정
두 중 명은 큰돈을 빌려야 할 때 이가 도와줄 없다고 했다,부정
명 중 이가 갑자기 큰돈을 빌려야 할 도와줄 명은 아무도 없다고 했다,부정
명 한 명은 갑자기 큰돈을 도와줄 할 빌려야 이가 아무도 없다고 했다,부정
두 한 명은 큰돈을 갑자기 빌려야 할 때 도와줄 이가 없다고 했다,부정
두 중 한 없다고 큰돈을 빌려야 할 때 도와줄 이가 아무도 명은 했다,부정
두 중 한 명은 갑자기 없다고 빌려야 할 도와줄 이가 큰돈을 했다,부정
두 명 명은 이가 빌려야 할 때 도와줄 큰돈을 없다고 했다,부정
명 중 명은 갑자기 할 빌려야 큰돈을 도와줄 이가 없다고 했다,부정
명 명은 이가 큰돈을 빌려야 할 때 도와줄 갑자기 없다고 했다,부정
청와대나 정부 고위급에서 공급은 충분하다고 말하면 늘릴 공급을 실무진에선 명분도 그럴 필요도 없어진다,부정
특히 명분도 정부 고위급에서 공급은 충분하다고 말하면 실무진에선 공급을 늘릴 청와대나 그럴 없어진다,부정
청와대나 정부 고위급에서 공급은 충분하다고 말하면 명분도 공급을 늘릴 실무진에선 그럴 없어진다,부정
청와대나 정부 고위급에서 공급은 충분하다고 말하면 실무진에선 공급을 필요도 명분도 그럴 늘릴 없어진다,부정
청와대나 정부 충분하다고 공급은 고위급에서 말하면 실무진에선 공급을 늘릴 명분도 그럴 필요도 없어진다,부정
청와대나 그럴 고위급에서 공급은 충분하다고 말하면 실무진에선 공급을 늘릴 명분도 정부 필요도 없어진다,부정
청와대나 정부 그럴 공급은 충분하다고 말하면 실무진에선 공급을 늘릴 명분도 고위급에서 없어진다,부정
청와대나 정부 공급은 고위급에서 충분하다고 말하면 실무진에선 공급을 늘릴 명분도 그럴 필요도 없어진다,부정
특히 청와대나 그럴 고위급에서 공급은 충분하다고 말하면 실무진에선 공급을 늘릴 명분도 정부 없어진다,부정
혹여 중국에서 사들여온 철제품이 이를 조선에서는 손상되면 단련하지 못했다,부정
사들여온 조선에서는 손상되면 철제품이 이를 다시 단련하지 못했다,부정
혹여 사들여온 단련하지 손상되면 조선에서는 이를 철제품이 못했다,부정
사들여온 철제품이 조선에서는 손상되면 이를 단련하지 못했다,부정
혹여 중국에서 조선에서는 철제품이 손상되면 사들여온 이를 다시 단련하지 못했다,부정
혹여 사들여온 철제품이 손상되면 조선에서는 다시 이를 단련하지 못했다,부정
사들여온 철제품이 손상되면 조선에서는 단련하지 이를 못했다,부정
조치에서 많으면서 풍선효과로 홍콩 보험사들이 자산가가 비롯된 통화가치가 불안한 한국을 겨냥 본토 공백을 메우려 했다는 해석이 나온다,부정
조치에서 불안한 풍선효과로 홍콩 보험사들이 자산가가 많으면서 통화가치가 비롯된 한국을 겨냥 본토 공백을 메우려 했다는 해석이 나온다,부정
조치에서 비롯된 풍선효과로 홍콩 보험사들이 자산가가 많으면서 메우려 불안한 한국을 겨냥 본토 영업 공백을 통화가치가 했다는 해석이 나온다,부정
조치에서 해석이 풍선효과로 홍콩 보험사들이 자산가가 많으면서 통화가치가 불안한 한국을 겨냥 본토 영업 공백을 메우려 했다는 비롯된 나온다,부정
조치에서 비롯된 풍선효과로 홍콩 본토 자산가가 많으면서 통화가치가 불안한 한국을 겨냥 보험사들이 영업 공백을 메우려 했다는 해석이 나온다,부정
이런 조치에서 비롯된 풍선효과로 본토 보험사들이 자산가가 많으면서 통화가치가 불안한 한국을 겨냥 홍콩 공백을 메우려 했다는 해석이 나온다,부정
이런 조치에서 비롯된 풍선효과로 홍콩 보험사들이 자산가가 공백을 통화가치가 불안한 한국을 겨냥 본토 많으면서 메우려 했다는 해석이 나온다,부정
조치에서 비롯된 겨냥 홍콩 보험사들이 자산가가 많으면서 통화가치가 불안한 한국을 풍선효과로 본토 영업 공백을 메우려 했다는 해석이 나온다,부정
이런 한국을 비롯된 풍선효과로 홍콩 보험사들이 자산가가 많으면서 통화가치가 불안한 조치에서 겨냥 본토 공백을 메우려 했다는 해석이 나온다,부정
더불어시민당에 참여한 정당들이 1 이상 지지를 받을 정당이라면 문제가 없지만 수준의 지지를 받기 어렵다면 오히려 표심이 과대 대표되는 현상이 나타난다,부정
참여한 정당들이 이상 지지를 받을 정당이라면 문제가 수준의 없지만 지지를 받기 어렵다면 표심이 과대 대표되는 현상이 나타난다,부정
참여한 정당들이 이상 지지를 받을 수 정당이라면 문제가 없지만 그런 수준의 지지를 받기 어렵다면 오히려 표심이 과대 대표되는 현상이 나타난다,부정
더불어시민당에 참여한 정당들이 선거에서 이상 지지를 받을 수 정당이라면 문제가 없지만 그런 수준의 지지를 받기 어렵다면 표심이 과대 대표되는 현상이 나타난다,부정
참여한 정당들이 이상 지지를 받을 수 표심이 정당이라면 문제가 없지만 수준의 지지를 받기 어렵다면 있는 과대 대표되는 현상이 나타난다,부정
참여한 정당들이 이상 지지를 받을 있는 정당이라면 문제가 없지만 수준의 지지를 받기 과대 표심이 어렵다면 대표되는 현상이 나타난다,부정
참여한 정당들이 선거에서 이상 지지를 받을 있는 정당이라면 문제가 없지만 그런 수준의 지지를 받기 어렵다면 오히려 표심이 과대 대표되는 현상이 나타난다,부정
더불어시민당에 참여한 정당들이 이상 지지를 받을 있는 정당이라면 문제가 없지만 수준의 지지를 받기 어렵다면 오히려 표심이 과대 대표되는 현상이 나타난다,부정
참여한 정당들이 1 이상 지지를 받을 수 정당이라면 문제가 없지만 수준의 지지를 받기 어렵다면 과대 표심이 대표되는 현상이 나타난다,부정
뉴턴의 수 극명하게 말해주듯 우리는 거품 속에서 거품을 볼 사례가 없다,부정
뉴턴의 사례가 극명하게 말해주듯 거품 우리는 속에서 거품을 볼,부정
뉴턴의 사례가 말해주듯 극명하게 우리는 거품 속에서 거품을 볼,부정
뉴턴의 사례가 우리는 말해주듯 극명하게 거품 거품을 볼,부정
뉴턴의 극명하게 사례가 말해주듯 우리는 거품 속에서 거품을 볼,부정
뉴턴의 극명하게 사례가 말해주듯 우리는 거품 거품을 볼 수,부정
뉴턴의 말해주듯 극명하게 사례가 우리는 거품 속에서 거품을 볼,부정
뉴턴의 우리는 극명하게 말해주듯 사례가 거품 거품을 볼 없다,부정
뉴턴의 사례가 거품을 말해주듯 우리는 거품 극명하게 볼 수,부정
부영 측은 별다른 입장이 없다고 제1의 용산구 실시계획인가를 두고 했지만 소송을 제기할 배제할 수 없다,부정
부영 측은 별다른 입장이 없다고 제기할 용산구 실시계획인가를 두고 제1의 소송을 했지만 배제할,부정
부영 측은 입장이 제1의 했지만 용산구 실시계획인가를 두고 없다고 소송을 제기할 가능성도 배제할 없다,부정
부영 측은 별다른 입장이 없다고 했지만 용산구 실시계획인가를 두고 제1의 배제할 제기할 소송을 수,부정
부영 측은 입장이 없다고 했지만 용산구 제1의 두고 실시계획인가를 소송을 제기할 배제할 수,부정
부영 측은 입장이 없다고 했지만 용산구 실시계획인가를 제기할 제1의 소송을 두고 가능성도 배제할 수,부정
부영 없다고 입장이 측은 했지만 용산구 실시계획인가를 두고 제1의 소송을 제기할 배제할 없다,부정
부영 측은 입장이 제기할 했지만 용산구 실시계획인가를 두고 제1의 소송을 없다고 가능성도 배제할 수 없다,부정
부영 측은 별다른 입장이 없다고 했지만 제기할 실시계획인가를 두고 제1의 소송을 용산구 가능성도 배제할 수,부정
지난달 소집 명단을 발표한 뒤 이강인발렌시아 백승호다름슈타트 어리고 경험 많은 선수들 자리를 비워놨지만 소속팀과 협의되지 않아 이들 선수를 쓸 됐다,부정
김 지난달 소집 명단을 발표한 뒤 이강인발렌시아 백승호다름슈타트 등 경험 많은 선수들 자리를 비워놨지만 소속팀과 협의되지 않아 이들 선수를 쓸 없게 됐다,부정
김 감독은 지난달 말 소집 명단을 발표한 뒤 이강인발렌시아 백승호다름슈타트 어리고 경험 선수들 자리를 비워놨지만 소속팀과 협의되지 않아 이들 선수를 쓸 수 됐다,부정
김 감독은 지난달 소집 명단을 발표한 뒤 이강인발렌시아 백승호다름슈타트 어리고 경험 선수들 자리를 비워놨지만 소속팀과 협의되지 않아 이들 선수를 쓸 수 됐다,부정
김 감독은 지난달 소집 명단을 발표한 뒤 이강인발렌시아 백승호다름슈타트 어리고 경험 많은 선수들 자리를 비워놨지만 소속팀과 협의되지 않아 이들 선수를 쓸 됐다,부정
지난달 소집 명단을 발표한 뒤 이강인발렌시아 백승호다름슈타트 등 어리고 경험 선수들 자리를 비워놨지만 소속팀과 협의되지 않아 이들 선수를 쓸 됐다,부정
김 지난달 소집 명단을 발표한 뒤 이강인발렌시아 백승호다름슈타트 어리고 경험 많은 선수들 자리를 비워놨지만 소속팀과 협의되지 않아 이들 선수를 쓸 됐다,부정
김 감독은 지난달 소집 명단을 발표한 뒤 이강인발렌시아 백승호다름슈타트 등 경험 선수들 자리를 비워놨지만 소속팀과 협의되지 않아 이들 선수를 쓸 없게 됐다,부정
김 지난달 말 소집 명단을 발표한 뒤 이강인발렌시아 백승호다름슈타트 어리고 경험 많은 선수들 자리를 비워놨지만 소속팀과 협의되지 않아 이들 선수를 쓸 수 됐다,부정
대한 이해가 인간에 대한 이끄는 이해를 접어들고 있다,부정
뇌에 대한 이해가 접어들고 이해를 이끄는 시대로 대한 있다,부정
바야흐로 대한 이해를 대한 이해가 이끄는 접어들고 있다,부정
뇌에 대한 접어들고 인간에 대한 이해를 이끄는 이해가 있다,부정
대한 이해가 이끄는 이해를 대한 접어들고 있다,부정
대한 이해가 접어들고 대한 이해를 이끄는 인간에 있다,부정
바야흐로 대한 이해가 인간에 대한 시대로 이끄는 이해를 접어들고 있다,부정
대한 이해가 이해를 대한 인간에 이끄는 시대로 접어들고 있다,부정
배달 앱은 플랫폼을 통한 배달이라는 신개념을 바탕으로 시장과 다양한 혁신을 이런 있는데 창출하고 측면을 무시해서는 안 된다,부정
배달 앱은 플랫폼을 통한 배달이라는 신개념을 다양한 시장과 혁신을 창출하고 있는데 측면을 무시해서는 안 된다,부정
배달 창출하고 플랫폼을 통한 배달이라는 신개념을 바탕으로 시장과 다양한 혁신을 앱은 있는데 이런 측면을 무시해서는 안 된다,부정
배달 앱은 플랫폼을 바탕으로 배달이라는 신개념을 통한 새로운 시장과 다양한 혁신을 창출하고 있는데 측면을 무시해서는 안 된다,부정
배달 앱은 플랫폼을 통한 배달이라는 신개념을 시장과 창출하고 혁신을 다양한 있는데 측면을 무시해서는 안 된다,부정
배달 앱은 플랫폼을 통한 혁신을 신개념을 시장과 다양한 배달이라는 창출하고 있는데 이런 측면을 무시해서는 안 된다,부정
배달 앱은 배달이라는 통한 플랫폼을 신개념을 새로운 시장과 다양한 혁신을 창출하고 있는데 이런 측면을 무시해서는 안 된다,부정
배달 앱은 안 통한 배달이라는 신개념을 시장과 다양한 혁신을 창출하고 있는데 이런 측면을 무시해서는 플랫폼을 된다,부정
배달 앱은 플랫폼을 통한 배달이라는 신개념을 새로운 시장과 다양한 혁신을 이런 있는데 창출하고 측면을 무시해서는 안 된다,부정
최근 들어 둔해져 운동신경이 몸이 생각대로 잘 움직여지지 않는다,부정
최근 들어 운동신경이 둔해져 움직여지지 생각대로 몸이 않는다,부정
최근 들어 둔해져 운동신경이 몸이 생각대로 움직여지지 않는다,부정
최근 운동신경이 들어 둔해져 몸이 생각대로 잘 움직여지지 않는다,부정
최근 들어 움직여지지 둔해져 몸이 생각대로 운동신경이 않는다,부정
최근 둔해져 운동신경이 들어 몸이 생각대로 움직여지지 않는다,부정
최근 들어 몸이 둔해져 운동신경이 생각대로 잘 움직여지지 않는다,부정
최근 들어 운동신경이 둔해져 잘 생각대로 몸이 움직여지지 않는다,부정
최근 들어 운동신경이 생각대로 몸이 둔해져 움직여지지 않는다,부정
밥 먹은 뒤 눕거나 종일 가만히 앉아 안 있어서는 된다,부정
밥 먹은 뒤 눕거나 종일 앉아 안 있어서는 된다,부정
밥 먹은 뒤 즉시 눕거나 종일 앉아 안 있어서는 된다,부정
밥 즉시 뒤 먹은 눕거나 종일 앉아 있어서는 안 된다,부정
밥 먹은 뒤 있어서는 종일 앉아 눕거나 안 된다,부정
밥 먹은 뒤 종일 눕거나 앉아 있어서는 안 된다,부정
밥 뒤 먹은 눕거나 종일 앉아 있어서는 안 된다,부정
밥 먹은 뒤 눕거나 앉아 종일 있어서는 안 된다,부정
밥 먹은 뒤 종일 눕거나 즉시 앉아 있어서는 안 된다,부정
문학계 성공한 한 그는 1권 넘는 좁히기에 손수 꿰맸고 세계와 문학의 간극을 책을 게으른 적,부정
문학계 성공한 그는 1권 넘는 책을 게으른 세계와 문학의 간극을 좁히기에 꿰맸고 적,부정
문학계 성공한 편집자이기도 한 그는 넘는 게으른 꿰맸고 세계와 문학의 간극을 좁히기에 책을 적,부정
문학계 성공한 손수 그는 1권 넘는 책을 한 꿰맸고 세계와 문학의 간극을 좁히기에 게으른 적 없다,부정
문학계 성공한 그는 넘는 책을 간극을 꿰맸고 세계와 문학의 손수 좁히기에 게으른,부정
문학계 책을 한 그는 넘는 성공한 꿰맸고 세계와 문학의 간극을 좁히기에 게으른 적,부정
문학계 성공한 편집자이기도 그는 넘는 책을 게으른 세계와 문학의 간극을 좁히기에 꿰맸고 적,부정
문학계 성공한 편집자이기도 그는 손수 책을 넘는 꿰맸고 세계와 문학의 간극을 좁히기에 게으른 적,부정
문학계 성공한 편집자이기도 그는 넘는 책을 손수 꿰맸고 문학의 세계와 간극을 좁히기에 게으른 없다,부정
넥슨대표 이정헌이 매년 행사 국내 최대 게임 지식공유 개최하는 넥슨개발자콘퍼런스a가 신종 코로나바이러스 감염증코로나1 잠정 연기됐다,부정
넥슨대표 신종 매년 개최하는 국내 최대 게임 지식공유 행사 넥슨개발자콘퍼런스a가 이정헌이 코로나바이러스 감염증코로나1 우려에 잠정 연기됐다,부정
넥슨대표 이정헌이 매년 개최하는 국내 최대 신종 지식공유 행사 넥슨개발자콘퍼런스a가 게임 코로나바이러스 감염증코로나1 우려에 잠정 연기됐다,부정
넥슨대표 이정헌이 개최하는 매년 국내 최대 게임 지식공유 행사 넥슨개발자콘퍼런스a가 신종 코로나바이러스 감염증코로나1 잠정 연기됐다,부정
넥슨대표 이정헌이 매년 개최하는 국내 신종 게임 지식공유 행사 넥슨개발자콘퍼런스a가 최대 코로나바이러스 감염증코로나1 잠정 연기됐다,부정
넥슨대표 개최하는 매년 이정헌이 국내 최대 게임 지식공유 행사 넥슨개발자콘퍼런스a가 신종 코로나바이러스 감염증코로나1 잠정 연기됐다,부정
넥슨대표 이정헌이 매년 게임 국내 최대 개최하는 지식공유 행사 넥슨개발자콘퍼런스a가 신종 코로나바이러스 감염증코로나1 잠정 연기됐다,부정
넥슨대표 국내 매년 개최하는 이정헌이 최대 게임 지식공유 행사 넥슨개발자콘퍼런스a가 신종 코로나바이러스 감염증코로나1 잠정 연기됐다,부정
넥슨대표 이정헌이 매년 개최하는 국내 지식공유 게임 최대 행사 넥슨개발자콘퍼런스a가 신종 코로나바이러스 감염증코로나1 잠정 연기됐다,부정
아카데미 후보 지난 1년 아쉽게도 버튼의 시간은 간다 머니볼로 올랐던 브래드 피트는 벤자민 인연을 맺지 못했다,부정
1년에 남우조연상 지난 1년 1년에는 벤자민 버튼의 시간은 거꾸로 간다 머니볼로 올랐던 브래드 아카데미 아쉽게도 피트는 인연을 맺지 못했다,부정
아카데미 남우조연상 후보 몽키즈 지난 1년 벤자민 버튼의 시간은 간다 머니볼로 남우주연상 올랐던 브래드 피트는 아쉽게도 연기상과 인연을 맺지 못했다,부정
후보 1 몽키즈 지난 1년 벤자민 버튼의 시간은 거꾸로 간다 머니볼로 남우주연상 후보에 올랐던 브래드 피트는 아쉽게도 인연을 맺지 못했다,부정
남우조연상 후보 몽키즈 1년 1년에는 벤자민 버튼의 시간은 간다 머니볼로 브래드 올랐던 피트는 아쉽게도 인연을 맺지 못했다,부정
지난 1년에 인연을 후보 몽키즈 1년 벤자민 버튼의 시간은 간다 머니볼로 올랐던 브래드 피트는 아쉽게도 아카데미 맺지 못했다,부정
지난 아카데미 남우조연상 몽키즈 1년 벤자민 버튼의 시간은 간다 머니볼로 브래드 올랐던 남우주연상 피트는 아쉽게도 아카데미 인연을 맺지 못했다,부정
지난 아카데미 남우조연상 후보 지난 1년 벤자민 버튼의 시간은 간다 머니볼로 맺지 브래드 피트는 아쉽게도 인연을 올랐던 못했다,부정
지난 아카데미 1 지난 1년 1년에는 벤자민 버튼의 시간은 맺지 머니볼로 올랐던 브래드 피트는 아쉽게도 인연을 간다 못했다,부정
무제한 때도 붙은 조치는 외환위기나 금융위기 용어가 전례가 없습니다,부정
무제한 용어가 붙은 조치는 외환위기나 전례가 때도 금융위기 없습니다,부정
무제한 용어가 붙은 조치는 외환위기나 전례가 금융위기 없습니다,부정
무제한 금융위기 붙은 조치는 외환위기나 용어가 전례가 없습니다,부정
무제한 전례가 붙은 조치는 외환위기나 금융위기 때도 용어가 없습니다,부정
무제한 금융위기 붙은 조치는 외환위기나 용어가 때도 전례가 없습니다,부정
무제한 용어가 붙은 조치는 전례가 금융위기 때도 외환위기나 없습니다,부정
무제한 용어가 조치는 붙은 외환위기나 금융위기 전례가 없습니다,부정
무제한 외환위기나 붙은 조치는 용어가 금융위기 때도 전례가 없습니다,부정
첫 필요 퍼터가 홀에서는 없었다,부정
첫 퍼터가 홀에서는 필요 없었다,부정
첫 홀에서는 필요 퍼터가 없었다,부정
이들은 외 1시간 초과근무를 했는데도 시간 1시간 근무수당을 받지 못했다,부정
이들은 1시간 1시간 받지 외 근무수당을 초과근무를 못했다,부정
이들은 1시간 1시간 초과근무를 근무수당을 외 시간 받지 못했다,부정
이들은 1시간 시간 초과근무를 했는데도 1시간 근무수당을 받지 못했다,부정
이들은 했는데도 1시간 1시간 초과근무를 각각 근무수당을 받지 못했다,부정
이들은 1시간 1시간 초과근무를 시간 받지 근무수당을 못했다,부정
이들은 1시간 외 초과근무를 했는데도 시간 1시간 근무수당을 받지 못했다,부정
이들은 시간 1시간 초과근무를 했는데도 1시간 근무수당을 받지 못했다,부정
이들은 초과근무를 1시간 1시간 근무수당을 받지 못했다,부정
눈부신 계절이다 눈부심을 여름철 가볍게만 봐서는 안 된다,부정
눈부신 계절이다 하지만 여름철 눈부심을 봐서는 가볍게만 안 된다,부정
계절이다 하지만 가볍게만 여름철 봐서는 안 된다,부정
계절이다 봐서는 가볍게만 여름철 안 된다,부정
여름은 눈부신 봐서는 여름철 가볍게만 계절이다 안 된다,부정
계절이다 하지만 여름철 봐서는 가볍게만 눈부심을 안 된다,부정
눈부신 계절이다 가볍게만 여름철 봐서는 안 된다,부정
여름은 여름철 계절이다 눈부심을 가볍게만 봐서는 안 된다,부정
피닉스는 영화 글래디에이터1 후보에 마스터1로 올랐으나 모두 수상에는 실패했다,부정
피닉스는 이전에도 영화 글래디에이터1 앙코르1 후보에 번 마스터1로 올랐으나 수상에는 실패했다,부정
피닉스는 이전에도 영화 글래디에이터1 앙코르1 올랐으나 마스터1로 수상에는 실패했다,부정
피닉스는 이전에도 영화 글래디에이터1 앙코르1 마스터1로 수상에는 후보에 올랐으나 세 실패했다,부정
피닉스는 이전에도 영화 글래디에이터1 후보에 세 마스터1로 올랐으나 수상에는 실패했다,부정
피닉스는 올랐으나 영화 글래디에이터1 앙코르1 마스터1로 후보에 이전에도 수상에는 실패했다,부정
피닉스는 이전에도 영화 마스터1로 글래디에이터1 세 올랐으나 모두 수상에는 실패했다,부정
피닉스는 영화 세 마스터1로 글래디에이터1 후보에 올랐으나 모두 수상에는 실패했다,부정
피닉스는 이전에도 글래디에이터1 영화 앙코르1 마스터1로 올랐으나 수상에는 실패했다,부정
