문장,극성
그것은 주요 운전 민간 비즈니스 부문에서 승용차의 탈출을 촉진하고 시민과 함께 대한 공격 발전뿐만 아니라 승용차의 감소를위한 기관 선택의 정책을 촉진 할 계획이다,미정
콘택트 눈에 너무 오랫동안 착용하면 렌즈를 손상을 줄 있다,미정
콘택트 수 오랫동안 착용하면 눈에 손상을 줄 렌즈를 있다,미정
콘택트 렌즈를 줄 착용하면 손상을 오랫동안 수 있다,미정
콘택트 렌즈를 오랫동안 착용하면 수 손상을 눈에 있다,미정
콘택트 손상을 너무 오랫동안 착용하면 렌즈를 줄 수 있다,미정
콘택트 렌즈를 너무 줄 착용하면 눈에 손상을 오랫동안 수 있다,미정
콘택트 착용하면 너무 오랫동안 렌즈를 손상을 있다,미정
콘택트 렌즈를 너무 착용하면 오랫동안 손상을 줄 있다,미정
둘째 콘택트 눈에 오랫동안 착용하면 렌즈를 손상을 줄 있다,미정
그러나 현실은 어떻나요,미정
코로나 위험이 감염 바이러스 있습니까,미정
코로나 바이러스 위험이 감염 있습니까,미정
코로나 감염 바이러스 위험이 있습니까,미정
코로나가 따라 자동차의 것으로 보수 검사 바뀔 유지 예상된다,미정
코로나가 조직함에 따라 검사 유지 보수 자동차의 바뀔 예상된다,미정
코로나가 보수 자동차의 유지 따라 검사 바뀔 예상된다,미정
코로나가 유지 자동차의 따라 보수 및 검사 바뀔 예상된다,미정
코로나가 따라 검사 유지 보수 및 자동차의 바뀔 예상된다,미정
코로나가 따라 바뀔 유지 보수 검사 자동차의 예상된다,미정
코로나가 조직함에 따라 자동차의 유지 보수 바뀔 검사 예상된다,미정
코로나가 조직함에 따라 보수 유지 자동차의 및 검사 방법도 바뀔 예상된다,미정
코로나가 따라 자동차의 유지 및 보수 검사 바뀔 것으로 예상된다,미정
치료 시간을 심한 증상이 악화 될 수 있으며 놓치면 경우에는 장님으로 이어질 수 있다,미정
치료 시간을 점차 증상이 놓치면 악화 될 수 있으며 경우에는 이어질 있다,미정
치료 시간을 놓치면 증상이 악화 수 있으며 경우에는 이어질 될 있다,미정
치료 시간을 놓치면 수 점차 악화 될 증상이 있으며 경우에는 이어질 있다,미정
치료 시간을 놓치면 이어질 점차 악화 될 있으며 심한 경우에는 증상이 있다,미정
치료 시간을 놓치면 증상이 악화 수 수 있으며 심한 경우에는 이어질 될 있다,미정
치료 시간을 놓치면 장님으로 악화 될 수 있으며 심한 경우에는 증상이 이어질 수 있다,미정
치료 경우에는 놓치면 증상이 악화 될 있으며 심한 시간을 장님으로 이어질 있다,미정
치료 시간을 놓치면 증상이 악화 될 수 있으며 경우에는 심한 장님으로 이어질 수 있다,미정
그는 56년 100명 중 10명은 기술을 보여주었지만 100명 최근에는 5명으로 떨어진 보인다고 말했다,미정
그는 5명으로 100명 중 10명은 기술을 보여주었지만 최근에는 100명 56년 떨어진 것으로 보인다고 말했다,미정
그는 56년 100명 중 10명은 훌륭한 기술을 보여주었지만 최근에는 100명 중 5명으로 보인다고 떨어진 말했다,미정
그는 56년 전까지 최근에는 중 10명은 기술을 보여주었지만 100명 100명 떨어진 보인다고 말했다,미정
그는 56년 떨어진 10명은 훌륭한 기술을 보여주었지만 최근에는 100명 중 5명으로 100명 것으로 보인다고 말했다,미정
그는 56년 전까지 보인다고 10명은 훌륭한 기술을 보여주었지만 최근에는 100명 떨어진 100명 말했다,미정
그는 56년 전까지 100명 10명은 보인다고 보여주었지만 최근에는 100명 중 5명으로 떨어진 기술을 말했다,미정
그는 56년 100명 10명은 훌륭한 기술을 보인다고 최근에는 100명 중 떨어진 것으로 보여주었지만 말했다,미정
그는 떨어진 전까지 100명 10명은 기술을 보여주었지만 최근에는 100명 중 5명으로 56년 것으로 보인다고 말했다,미정
그는 전통적인 뇌졸중에 대한 예방 조치 외에도 전 세계적으로 사망률이 있으며 삶의 질을 향상시키는 치매와 알츠하이머 치료도 결과를 향상시킬 것이라고 말했다,미정
그는 전통적인 대한 예방 조치 전 높은 사망률이 있으며 삶의 질을 치료도 치매와 알츠하이머 향상시키는 결과를 향상시킬 것이라고 말했다,미정
그는 전통적인 뇌졸중에 대한 예방 조치 세계적으로 높은 사망률이 있으며 삶의 질을 향상시키는 치매와 알츠하이머 치료도 그 결과를 향상시킬 것이라고 말했다,미정
그는 전통적인 뇌졸중에 대한 예방 조치 외에도 세계적으로 높은 사망률이 있으며 삶의 질을 향상시키는 치매와 알츠하이머 치료도 결과를 향상시킬 것이라고 말했다,미정
그는 전통적인 대한 예방 조치 외에도 전 세계적으로 사망률이 있으며 삶의 질을 향상시키는 치매와 알츠하이머 치료도 그 결과를 향상시킬 것이라고 말했다,미정
그는 전통적인 대한 예방 조치 전 세계적으로 높은 사망률이 있으며 삶의 질을 향상시키는 치매와 알츠하이머 치료도 결과를 향상시킬 것이라고 말했다,미정
그는 전통적인 뇌졸중에 대한 예방 조치 외에도 전 세계적으로 사망률이 있으며 삶의 질을 향상시키는 치매와 알츠하이머 치료도 그 결과를 향상시킬 것이라고 말했다,미정
그는 전통적인 대한 예방 조치 전 높은 사망률이 있으며 삶의 질을 향상시키는 치매와 알츠하이머 치료도 그 결과를 향상시킬 것이라고 말했다,미정
특히 일몰이 떨어지는 폭풍과 중앙 내부 지역 주위에 지역에서는 폭풍이 떨어지는 것과 폭풍과 폭풍이 발생할 것이다,미정
일몰이 떨어지는 것과 중앙 내부 지역 폭풍과 폭풍이 떨어지는 지역에서는 함께 폭풍과 폭풍이 발생할 것이다,미정
특히 일몰이 떨어지는 지역 중앙 내부 지역에서는 폭풍과 폭풍이 떨어지는 것과 폭풍과 폭풍이 발생할 것이다,미정
특히 일몰이 떨어지는 지역에서는 중앙 내부 지역 주위에 발생할 폭풍이 떨어지는 것과 폭풍과 폭풍이 폭풍과 것이다,미정
일몰이 떨어지는 지역에서는 중앙 내부 지역 폭풍과 폭풍이 떨어지는 것과 발생할 폭풍이 폭풍과 것이다,미정
일몰이 것과 지역에서는 중앙 내부 지역 폭풍과 폭풍이 떨어지는 떨어지는 함께 폭풍과 폭풍이 발생할 것이다,미정
특히 일몰이 떨어지는 지역에서는 내부 중앙 지역 폭풍과 폭풍이 떨어지는 것과 폭풍과 폭풍이 발생할 것이다,미정
특히 일몰이 떨어지는 지역에서는 중앙 내부 지역 주위에 폭풍과 폭풍이 떨어지는 것과 함께 발생할 폭풍이 폭풍과 것이다,미정
일몰이 떨어지는 폭풍이 중앙 내부 지역 주위에 폭풍과 폭풍이 떨어지는 것과 폭풍과 지역에서는 발생할 것이다,미정
현재 대표 학생들이 활동하고 숫자는 그 있으며 점차 300명으로 늘어날 예정이다,미정
현재 125명의 대표 있으며 활동하고 학생들이 숫자는 늘어날 예정이다,미정
현재 그 학생들이 활동하고 있으며 대표 숫자는 점차 300명으로 늘어날 예정이다,미정
현재 학생들이 대표 125명의 활동하고 있으며 숫자는 300명으로 늘어날 예정이다,미정
현재 늘어날 학생들이 활동하고 있으며 숫자는 점차 대표 예정이다,미정
현재 그 대표 학생들이 활동하고 있으며 125명의 숫자는 점차 늘어날 예정이다,미정
현재 125명의 대표 점차 활동하고 있으며 숫자는 학생들이 늘어날 예정이다,미정
현재 활동하고 학생들이 대표 있으며 숫자는 점차 늘어날 예정이다,미정
현재 학생들이 대표 125명의 활동하고 있으며 그 숫자는 늘어날 예정이다,미정
서울의 어디를 지역에서 여러 방문해야합니까,미정
서울의 여러 어디를 지역에서 방문해야합니까,미정
가장 좋은 어디에 목록은 있나요,미정
씨앗이 썩을 전송 신경은 영구적 인 씨앗으로 때 될 수 있다,미정
씨앗이 썩을 인 신경은 때 씨앗으로 전송 될 있다,미정
씨앗이 썩을 전송 신경은 인 씨앗으로 때 될 있다,미정
씨앗이 수 때 신경은 영구적 인 씨앗으로 전송 될 썩을 있다,미정
씨앗이 썩을 때 영구적 신경은 인 씨앗으로 전송 될 있다,미정
씨앗이 썩을 인 신경은 씨앗으로 전송 될 수 있다,미정
씨앗이 썩을 때 신경은 인 수 전송 될 씨앗으로 있다,미정
씨앗이 전송 때 신경은 인 씨앗으로 썩을 될 수 있다,미정
씨앗이 썩을 신경은 될 씨앗으로 전송 인 있다,미정
발표는 축제 후일지도 모른다,미정
월 바르셀로나 버밍엄 우리는 경로와 버밍엄 이스탄불 경로를 시작할 것이다,미정
7 우리는 버밍엄 바르셀로나 경로와 버밍엄 시작할 경로를 이스탄불 것이다,미정
월 경로를 버밍엄 바르셀로나 경로와 버밍엄 이스탄불 우리는 시작할 것이다,미정
우리는 시작할 바르셀로나 경로와 버밍엄 이스탄불 경로를 버밍엄 것이다,미정
월 우리는 버밍엄 바르셀로나 경로와 경로를 이스탄불 버밍엄 시작할 것이다,미정
7 우리는 시작할 바르셀로나 경로와 버밍엄 이스탄불 경로를 버밍엄 것이다,미정
월 우리는 버밍엄 버밍엄 경로와 바르셀로나 이스탄불 경로를 시작할 것이다,미정
우리는 버밍엄 바르셀로나 경로와 버밍엄 시작할 경로를 이스탄불 것이다,미정
당신이 내부에서 무거운 없다면 찾을 인사를 외부 있다,미정
당신이 외부 무거운 인사를 찾을 수 없다면 내부에서 낙하산이 수 있다,미정
당신이 내부에서 무거운 인사를 외부 수 없다면 찾을 낙하산이 수 있다,미정
당신이 내부에서 낙하산이 인사를 찾을 없다면 외부 무거운 올 있다,미정
당신이 무거운 인사를 찾을 수 없다면 외부 있다,미정
당신이 내부에서 무거운 인사를 외부 없다면 찾을 올 수 있다,미정
당신이 인사를 찾을 올 외부 낙하산이 없다면 있다,미정
당신이 무거운 찾을 인사를 없다면 외부 올 수 있다,미정
당신이 내부에서 찾을 인사를 무거운 없다면 외부 낙하산이 올 있다,미정
Baugh 교수는 국내 사업이라면 LP 자회사 부동산 시장이 완전히 운영되고 세금 혜택이 백업되어 중형 MA 시장이 활성화 될 수 있도록 번째 벤처 붐이 될 것입니다라고 말했다,미정
Baugh 교수는 국내 사업이라면 LP 자회사 부동산 시장이 운영되고 세금 혜택이 백업되어 중형 MA 시장이 활성화 될 수 있도록 번째 벤처 붐이 될 것입니다라고 말했다,미정
Baugh 교수는 국내 사업이라면 LP 자회사 부동산 시장이 운영되고 세금 혜택이 백업되어 중형 MA 시장이 활성화 될 있도록 번째 벤처 붐이 될 것입니다라고 말했다,미정
Baugh 교수는 국내 사업이라면 LP 자회사 부동산 시장이 운영되고 세금 혜택이 백업되어 중형 MA 시장이 활성화 될 있도록 두 번째 벤처 붐이 계속 될 것입니다라고 말했다,미정
Baugh 교수는 국내 사업이라면 LP 자회사 부동산 시장이 운영되고 세금 혜택이 백업되어 중형 MA 시장이 활성화 될 수 있도록 번째 벤처 붐이 계속 될 것입니다라고 말했다,미정
Baugh 교수는 국내 사업이라면 LP 자회사 부동산 시장이 운영되고 세금 혜택이 백업되어 중형 MA 시장이 활성화 될 있도록 번째 벤처 붐이 계속 될 것입니다라고 말했다,미정
Baugh 교수는 국내 사업이라면 LP 자회사 부동산 시장이 완전히 운영되고 세금 혜택이 백업되어 중형 MA 시장이 활성화 될 있도록 번째 벤처 붐이 계속 될 것입니다라고 말했다,미정
올해는 비행 영역과 시간을 권장할 축적된 데이터를 분석하고 기술을 발전시켜 승객에게 최적화된 맞춤형 비행 양식을 확장하는 것이다,미정
올해는 비행 영역과 양식을 확장하는 것 외에도 축적된 데이터를 분석하고 기술을 발전시켜 승객에게 최적화된 맞춤형 비행 시간을 권장할 것이다,미정
올해는 비행 영역과 시간을 확장하는 양식을 데이터를 분석하고 기술을 발전시켜 승객에게 최적화된 맞춤형 비행 축적된 권장할 것이다,미정
올해는 비행 영역과 시간을 확장하는 축적된 데이터를 분석하고 기술을 비행 승객에게 최적화된 맞춤형 발전시켜 양식을 권장할 것이다,미정
올해는 비행 영역과 시간을 확장하는 외에도 축적된 데이터를 분석하고 기술을 최적화된 승객에게 발전시켜 맞춤형 비행 양식을 권장할 것이다,미정
올해는 비행 영역과 시간을 확장하는 것 축적된 데이터를 분석하고 기술을 발전시켜 승객에게 최적화된 맞춤형 권장할 양식을 비행 것이다,미정
올해는 권장할 영역과 시간을 확장하는 것 축적된 데이터를 분석하고 기술을 발전시켜 승객에게 최적화된 맞춤형 비행 양식을 비행 것이다,미정
올해는 비행 기술을 시간을 확장하는 외에도 축적된 데이터를 분석하고 영역과 발전시켜 승객에게 최적화된 맞춤형 비행 양식을 권장할 것이다,미정
올해는 비행 영역과 승객에게 확장하는 축적된 데이터를 분석하고 기술을 발전시켜 시간을 최적화된 맞춤형 비행 양식을 권장할 것이다,미정
지난 12 월에 Steam에 Ally Access를 출시 그것을 이후 Steam은 한 최고의 릴리스로 선정했으며 올해 분기에 출시 될 것이다,미정
지난 12 Steam에 Ally Access를 출시 이후 Steam은 그것을 2019 년 최고의 릴리스로 선정했으며 올해 1 분기에 출시 될 것이다,미정
지난 Steam에 Ally 그것을 출시 한 이후 Steam은 Access를 2019 년 최고의 릴리스로 선정했으며 올해 분기에 될 것이다,미정
12 Steam에 Ally Access를 출시 이후 Steam은 그것을 최고의 올해 선정했으며 릴리스로 분기에 출시 될 것이다,미정
지난 Steam에 Ally Access를 출시 한 올해 Steam은 그것을 최고의 릴리스로 선정했으며 이후 1 분기에 될 것이다,미정
월에 Steam에 Ally Access를 2019 이후 Steam은 그것을 출시 최고의 릴리스로 선정했으며 올해 1 분기에 공식적으로 출시 될 것이다,미정
지난 12 Steam에 Ally Access를 출시 한 이후 Steam은 공식적으로 최고의 릴리스로 선정했으며 올해 분기에 그것을 될 것이다,미정
지난 12 월에 Steam에 Ally Access를 출시 한 이후 Steam은 최고의 그것을 릴리스로 선정했으며 올해 분기에 공식적으로 될 것이다,미정
12 월에 릴리스로 Ally Access를 출시 이후 Steam은 그것을 년 최고의 Steam에 선정했으며 올해 1 분기에 출시 될 것이다,미정
G 가져올 지능의 미래는 무엇을 인공 것인가,미정
5 G 인공 지능의 가져올 무엇을 미래는 것인가,미정
5 G 및 인공 가져올 미래는 무엇을 지능의 것인가,미정
G 및 가져올 지능의 미래는 무엇을 인공 것인가,미정
G 및 인공 지능의 가져올 무엇을 미래는 것인가,미정
5 G 인공 지능의 무엇을 미래는 가져올 것인가,미정
G 인공 지능의 미래는 가져올 무엇을 것인가,미정
G 및 인공 가져올 미래는 무엇을 지능의 것인가,미정
5 및 G 인공 지능의 미래는 무엇을 가져올 것인가,미정
올해의 수업은 진행될 안전하게 예정이다,미정
올해의 안전하게 수업은 진행될 예정이다,미정
올해의 진행될 안전하게 수업은 예정이다,미정
어쩌면 살아가는 잊어버렸을지도 것을 모른다,미정
어쩌면 것을 살아가는 잊어버렸을지도 모른다,미정
당신은 낚시 수시 사용 된 물고기를 키울 수 있으며 임무 물고기를 잃어버린 실패로 어느 정도 회복 할 수 있다,미정
당신은 실패로 수시 집에서 사용 된 물고기를 키울 있으며 임무 낚시 잃어버린 물고기를 어느 정도 회복 할 수 있다,미정
당신은 낚시 수시 사용 된 임무 키울 수 있으며 물고기를 잃어버린 물고기를 정도 회복 할 수 있다,미정
당신은 낚시 가게에서 수시 집에서 사용 된 물고기를 키울 있으며 임무 잃어버린 물고기를 정도 회복 할 수 있다,미정
당신은 낚시 가게에서 키울 사용 된 물고기를 수시 수 있으며 임무 잃어버린 물고기를 어느 정도 회복 할 수 있다,미정
당신은 낚시 가게에서 수시 집에서 사용 된 물고기를 키울 있으며 임무 실패로 잃어버린 물고기를 어느 정도 회복 할 수 있다,미정
당신은 낚시 수시 사용 키울 물고기를 된 있으며 임무 실패로 잃어버린 물고기를 어느 정도 회복 할 수 있다,미정
당신은 낚시 수시 집에서 사용 된 물고기를 키울 수 있으며 임무 할 잃어버린 물고기를 어느 정도 회복 실패로 있다,미정
당신은 낚시 수시 사용 된 물고기를 잃어버린 수 있으며 임무 실패로 키울 물고기를 정도 회복 할 수 있다,미정
LCH 개발 프로젝트는 국내 민간 헬리콥터를 대체하기위한 소형 광산 헬리콥터 개발 프로젝트이며 LAH와 같은 플랫폼을 기반으로 승객 운송 항해 응급 의료 안전 화재 압력 등을 작동 할 헬리콥터로 개발되고 있으며 2021 년에 완료 될 것이다,미정
LCH 개발 프로젝트는 국내 민간 헬리콥터를 대체하기위한 소형 광산 헬리콥터 개발 프로젝트이며 LAH와 플랫폼을 기반으로 승객 운송 항해 응급 의료 안전 화재 압력 등을 작동 할 헬리콥터로 개발되고 있으며 완료 될 것이다,미정
LCH 개발 프로젝트는 국내 민간 헬리콥터를 대체하기위한 소형 광산 헬리콥터 개발 프로젝트이며 LAH와 플랫폼을 승객 운송 항해 응급 의료 안전 화재 압력 등을 작동 할 수있는 헬리콥터로 개발되고 있으며 완료 될 것이다,미정
LCH 개발 프로젝트는 국내 민간 헬리콥터를 대체하기위한 소형 광산 헬리콥터 개발 프로젝트이며 LAH와 플랫폼을 승객 운송 항해 응급 의료 안전 화재 압력 등을 할 헬리콥터로 개발되고 있으며 2021 년에 완료 될 것이다,미정
LCH 개발 프로젝트는 국내 민간 헬리콥터를 대체하기위한 소형 광산 헬리콥터 개발 프로젝트이며 LAH와 같은 플랫폼을 기반으로 승객 운송 항해 응급 의료 안전 화재 압력 등을 할 다기능 헬리콥터로 개발되고 있으며 2021 년에 완료 될 것이다,미정
LCH 개발 프로젝트는 국내 민간 헬리콥터를 대체하기위한 소형 광산 헬리콥터 개발 프로젝트이며 LAH와 같은 플랫폼을 기반으로 승객 운송 항해 응급 의료 안전 화재 압력 등을 할 다기능 헬리콥터로 개발되고 있으며 완료 될 것이다,미정
LCH 개발 프로젝트는 국내 민간 헬리콥터를 대체하기위한 소형 광산 헬리콥터 개발 프로젝트이며 LAH와 플랫폼을 기반으로 승객 운송 항해 응급 의료 안전 화재 압력 등을 작동 할 수있는 다기능 헬리콥터로 개발되고 있으며 년에 완료 될 것이다,미정
LCH 개발 프로젝트는 국내 민간 헬리콥터를 대체하기위한 소형 광산 헬리콥터 개발 프로젝트이며 LAH와 같은 플랫폼을 기반으로 승객 운송 항해 응급 의료 안전 화재 압력 등을 할 수있는 다기능 헬리콥터로 개발되고 있으며 완료 될 것이다,미정
LCH 개발 프로젝트는 국내 민간 헬리콥터를 대체하기위한 소형 광산 헬리콥터 개발 프로젝트이며 LAH와 플랫폼을 승객 운송 항해 응급 의료 안전 화재 압력 등을 할 헬리콥터로 개발되고 있으며 완료 될 것이다,미정
새로운 19 코로나 테스트는 무엇입니까,미정
당신은 휴식 출발 치료 룸을 선택하거나 양육 할 능력을 습득 피트니스의 있다,미정
당신은 수 출발 치료 룸을 선택하거나 양육 과정에서 피트니스의 능력을 습득 할 휴식 있다,미정
당신은 휴식 양육 치료 룸을 선택하거나 출발 피트니스의 능력을 습득 할 수 있다,미정
당신은 휴식 출발 치료 룸을 선택하거나 양육 피트니스의 할 습득 능력을 수 있다,미정
당신은 휴식 출발 선택하거나 룸을 치료 양육 과정에서 피트니스의 능력을 습득 할 있다,미정
당신은 휴식 출발 치료 피트니스의 선택하거나 양육 과정에서 룸을 능력을 습득 할 수 있다,미정
당신은 휴식 룸을 치료 출발 선택하거나 양육 과정에서 피트니스의 능력을 습득 할 수 있다,미정
당신은 휴식 양육 치료 룸을 선택하거나 출발 피트니스의 능력을 습득 할 있다,미정
당신은 휴식 출발 치료 습득 선택하거나 양육 과정에서 피트니스의 능력을 룸을 할 있다,미정
Corona19 마스크를 아동 인증 착용해야합니까,미정
Corona19 인증 아동 마스크를 착용해야합니까,미정
해외는 한국 게임에 규제 대한 사용할 수 있다,미정
해외는 규제 대한 한국 사용할 수 있다,미정
해외는 한국 대한 사용할 규제 있다,미정
해외는 한국 대한 수 항목으로 사용할 규제 있다,미정
해외는 한국 대한 규제 사용할 항목으로 있다,미정
해외는 수 게임에 대한 규제 사용할 한국 있다,미정
해외는 한국 대한 게임에 규제 사용할 수 있다,미정
해외는 사용할 게임에 대한 규제 한국 수 있다,미정
해외는 한국 사용할 대한 규제 게임에 수 있다,미정
당신이 게임의 가진 진행할수록 당신은 영감을 이야기를 기존 레이싱 말의 특성과 특성을 보여주는 세계관을 볼 있다,미정
당신이 게임의 이야기를 진행할수록 당신은 각 캐릭터를 영감을 가진 기존 레이싱 특성과 말의 특성을 보여주는 세계관을 볼 있다,미정
당신이 특성과 이야기를 진행할수록 당신은 캐릭터를 영감을 가진 기존 레이싱 말의 게임의 특성을 보여주는 세계관을 볼 있다,미정
당신이 게임의 이야기를 진행할수록 당신은 각 캐릭터를 특성을 가진 기존 레이싱 말의 특성과 영감을 보여주는 세계관을 볼 있다,미정
당신이 게임의 이야기를 진행할수록 당신은 영감을 가진 기존 레이싱 말의 세계관을 특성을 보여주는 특성과 볼 있다,미정
당신이 게임의 이야기를 진행할수록 당신은 가진 영감을 각 기존 레이싱 말의 특성과 특성을 보여주는 세계관을 볼 수 있다,미정
당신이 게임의 이야기를 진행할수록 당신은 특성을 가진 기존 레이싱 말의 특성과 영감을 보여주는 세계관을 볼 수 있다,미정
당신이 게임의 이야기를 진행할수록 당신은 각 영감을 캐릭터를 가진 기존 레이싱 말의 특성과 특성을 보여주는 세계관을 볼 있다,미정
당신이 영감을 이야기를 진행할수록 당신은 각 게임의 가진 기존 레이싱 말의 특성과 특성을 보여주는 세계관을 볼 수 있다,미정
알고리즘 stablecoin의 특징적인 가격 회복 붕괴하고 고정이 흐름이 발생할 수 있다,미정
알고리즘 가격 특징적인 stablecoin의 고정이 붕괴하고 회복 흐름이 발생할 있다,미정
알고리즘 stablecoin의 특징적인 가격 고정이 수 회복 흐름이 발생할 붕괴하고 있다,미정
알고리즘 stablecoin의 발생할 가격 고정이 붕괴하고 회복 흐름이 특징적인 있다,미정
알고리즘 stablecoin의 특징적인 가격 발생할 붕괴하고 회복 흐름이 고정이 있다,미정
알고리즘 stablecoin의 특징적인 가격 붕괴하고 고정이 회복 흐름이 발생할 수 있다,미정
알고리즘 stablecoin의 특징적인 가격 고정이 붕괴하고 수 흐름이 발생할 회복 있다,미정
알고리즘 고정이 특징적인 가격 stablecoin의 붕괴하고 회복 흐름이 발생할 수 있다,미정
알고리즘 발생할 특징적인 가격 고정이 붕괴하고 회복 흐름이 stablecoin의 있다,미정
총 재단의 억 FORT가 제공되며 소지자는 1 지배 투표에 참여할 있다,미정
총 1 억 제공되며 FORT가 소지자는 재단의 지배 투표에 참여할 있다,미정
1 FORT가 제공되며 소지자는 재단의 참여할 투표에 지배 수 있다,미정
1 억 지배 제공되며 소지자는 재단의 FORT가 참여할 있다,미정
FORT가 재단의 소지자는 제공되며 지배 투표에 참여할 수 있다,미정
총 1 억 지배 제공되며 소지자는 재단의 FORT가 투표에 참여할 있다,미정
