문장,극성
화양정서울 성동구 살곶이목장 내에 있던 정자 앞에 목책을 세우고 각 읍에 예치했던 암말 수백 마리를 가둔 다음 연산이 정자에 자리를 잡았다,긍정
특히 방탄소년단은 지난해 1월 발매한 맵 오브 더 소울 페르소나의 글로벌 성공에 힘입어 1만장1년 1주 누적 기준의 앨범을 판매했다,긍정
곽 대표는 1년 전부터 기생충을 함께 구상 제작했으며 1a초고해상도 촬영 애트모스 녹음 막대한 비용을 쓴 세트 등을 기생충에서 완성했다,긍정
a1는 1년 치매 치료용 생약조성물로 특허를 받았다,긍정
화웨이가 탄소중립을 주요 의제로 끌고 나온 것도 흥미를 끌었다,긍정
1년 이스라엘이 건국되면서 삶의 터전을 잃은 팔레스타인들의 비극을 비석처럼 만든 작품이다,긍정
배우 설경구가 사람 잡아먹는 귀신이라는 뜻의 야차 지강인 역을 맡았다,긍정
가령 편당 기내 탑승을 두 건으로 제한한다면 두 번째 신청자 안에 들어야 한다,긍정
김종민 국회의원은 스타트업 창업 1년 후 생존율이 1일 정도로 낮고 법과 제도 지배구조와 사회적 신뢰 문제로 이어지는 회수 시장 문제로 인한 한계가 분명히 존재한다 기술 인력 자본 등 다양한 긍정적 요소를 갖춘 지금 토론회에서 나온 다양한 아이디어를 토대로 제도적 보완과 정책 개선을 통해 국내 스타트업 생태계 발전을 견인하는 데 힘쓰겠다고 말했다,긍정
개발원 관계자는 인터넷 사용에 익숙하고 가격에 민감한 1세대 연령층의 인터넷채널 가입률은 1대 이상 연령층 보다 1배 이상 높고 연평균 증가 폭도 1 포인트를 웃돌고 있다면서  빅데이터 연계를 통한 차량정보통합서비스a의 활용으로 자동차 세부사양을 모르더라도 차량 번호만 알면 보험료 산출이 가능하고 소요 시간도 단축된 점이 영향을 미친것 같다고 설명했다,긍정
초강력 계면활성제가 들어간 비누를 오래 사용할 경우 우리 몸의 세포 사이클을 교란해 돌연변이를 유도하기도 한다,긍정
아파트 등 주거지역에서 본인용 및 보호자용 장애인 주차표지를 붙인 차에 대한 단속기준이 지방자치단체별로 달라 민원이 지속해서 발생하자 단속 기준을 구체적으로 정한 것이다,긍정
상업은행 지점수 감소 화폐 전량 수입 잦은 지진 등의 지리적 특성 등으로 화폐유통시스템이 약화될 가능성에 대한 염려가 잇따라서다,긍정
북미 시장에서 가장 기대작으로 꼽히는 작품은 히어로 봉 감독의 콘텐츠다,긍정
1년 김시우1 이후 1년 만에 이 대회에 출전한 한국 국적 선수다,긍정
김정태 하나금융그룹 회장은 스타벅스는 더 이상 단순한 커피회사가 아니라 규제 받지 않는 은행이라 칭해도 무방할 것이라며 디지털금융 혁신을 선도해 새로운 비즈니스를 발굴하고 이를 통해 금융소외 계층 등을 지원해 나갈 것이라고 강조했다,긍정
살아있다는 것이 중요하다라는 제목의 이 책은 필립 빈젤 박사가 한 재판에 참여하는 사연으로 시작된다,긍정
금융정보 업체 에프앤가이드에 따르면 삼성자산운용의 금 a a 골드선물의 순자산총액은 최근 한 달 새 1억원 늘었고 한국투자신탁운용의 a a금현물도 같은 기간 순자산총액이 1억원 가까이 증가했다,긍정
고교생 훈련까지 챙겨보지만 적폐 팀장에게 막혀 자신의 뜻을 못 펴는 스카우트팀 직원이 있다,긍정
잡음은 확실히 주관적 판단이 중요한 정신의학에서 특히 높게 나타난다,긍정
국내 무대에서 1승을 거뒀고 미국 1승 일본 1승 유럽 1승 아시아에서 1승을 거뒀다,긍정
반전에 반전을 거듭하는 기생충이 환영을 받은 주요 이유다,긍정
아울러 대학신문 연세춘추에는 만평을 게재하며 날카로운 사회감각을 길렀다,긍정
판결 결과를 놓고 두나무에서는 업비트 공지사항을 통해 사기적 거래를 한 사실이 없고 보유하지 않은 암호화폐를 거래하거나 이 과정에서 회사 및 임직원이 이익을 취한 것이 없음을 소명했다며 당사의 주장이 법원에 받아들여져 무죄 판결을 받아 다행스럽게 생각한다고 밝혔다,긍정
약을 오래 사용한 사람들 중에는 자신이 가지고 있는 자연 치유력을 완전히 상실하여 약을 끊을 수 없는 사람들이 얼마나 많은지 모른다,긍정
사람들은 미래를 어떻게든 예측하려 한다,긍정
타임스스퀘어 주변엔 겹겹이 경찰 인력이 배치돼 출입을 엄격히 통제했고 폴리스라인을 따라 발디딜 틈없이 수많은 인파가 줄을 지었다,긍정
신제품인 비스포크 무풍에어컨 갤러리 체온풍은 계절이나 날씨에 따라 냉방체온풍청정제습 기능 등을 선택할 수 있다,긍정
이 같은 이유 등으로 1세대 1명 중 1명 이상은 자동차보험을 인터넷모바일 채널a로 가입해 보험료를 최대 1정도 아끼고 있는 것으로 나타났다,긍정
방산 사업이 연간 매출의 1 이상을 차지하는 한화에어로스페이스는 항공기와 우주 발사체 엔진과 부품 등에서 강점을 보인다,긍정
게임기획과 프로그래밍 데이터분석 메타버스와 대체불가토큰a 커리어 등 게임산업을 둘러싼 각 분야의 이슈와 트렌드를 살핀다,긍정
비영어권 영화가 아카데미 작품상을 받은 것은 1년 아카데미 역사상 최초다,긍정
영재를 키워야 할 교육부가 영재 죽이기에 앞장서고 있다,긍정
티모 뮐러는 이용자들의 피드백을 반영해 가능한 사용자 경험을 대폭 개선하는 것에 초점을 맞춰 플레이 전환 설정 도입과 다양한 팀 스킬 동작 추가 고급 패스와 페널티킥 시스템을 미세 조정에 집중했다라며 a 스포츠 공식 클럽 팀들로 즐길 수 있는 정통 챌린지 모드 어쎈틱 챌린지도 새롭게 도입할 예정으로 향후 연계한 이벤트도 진행할 계획이라고 설명했다,긍정
1년 전 전국을 강타했던 신당 돌풍은 직선제 개헌으로 이어지며 훗날 신군부 독재를 끝내고 민주화를 앞당기는 초석을 쌓았다,긍정
한국에서 열리는 건 이번이 처음으로 부산 대회에는 1개국에서 선수 1여 명과 각국 탁구협회 관계자 등 1여 명이 참가할 예정이다,긍정
1세 이상 저소득자에 대한 소득지원을 강화하기 위해 기초연금 월 최대 1만원 지원 대상을 소득 하위 1 이하에서 소득 하위 1 이하로 확대한다,긍정
경제계가 대내외 불확실성이 커진 경자년 새해를 맞아 1일 신년 인사회를 열고 위기 극복 의지를 함께 다졌다,긍정
김 대표는 이 같은 운송 성공률이 매우 높은 편이라고 자부했다,긍정
이 같은 투명하게 공개된 규칙 열린 참여와 기여에 따른 보상 가치의 저장 및 이동이라는 특성에 맞춰 정교한 설계가 적용된 블록체인 게임이 성공할 수 있을 것으로 내다봤다,긍정
이는 특정 세포로 약물을 전달할 수 있어 부작용을 줄이고 효과를 극대화하는 전달체로 주목받고 있다,긍정
호주 인도 카타르를 상대로 좋은 결과를 낸다고 해도 문제는 이란이다,긍정
이제 쓰지 않는 김민정을 상상하기 어렵지만 첫 계시의 순간은 언제였을까,긍정
이른바 우한 폐렴으로 불리는 신종 코로나 바이러스가 전세계로 확산되자 세계 증시는 악화되고 암호화폐 가격은 상승세를 보였다,긍정
특명을 내려 차중 중간 이상의 사람을 모두 넣어 급제를 주게 하니 신희복이 비로소 방에 끼게 되었다,긍정
원작의 대표 직업인 전사와 도사 술사가 등장하며 비천 오마동굴 등의 지역도 담아냈다,긍정
삼국사기삼국유사에 의하면 신라는 벌휴왕 1년1년 파진찬 구도에게 명해 조문국을 정벌한다,긍정
공자 존 스튜어트 밀 등 위대한 사상가에서부터 야구선수 오 사다하루 작곡가 존 케이지 등에 이르기까지 동서고금의 철학을 넘나들며 우리가 감정과 신체를 다스리는 데 도움을 줄 만한 전략을 소개한다,긍정
중고시장에서 고가에 팔리고 있는 그의 과거 앨범도 재발매할 계획이다,긍정
1척의 장검을 쥐고 말 위에 올라 성을 나섰다,긍정
온체인에 모든 정보를 기록해 누구나 볼 수 있도록 투명성을 가지고 있는 것과 열린 생태계를 통해 누구나 프로젝트에 기여할 수 있고 기여도에 따른 보상을 획득할 수 있는 것 a와 토큰을 통해 가치를 저장하고 교환할 수 있게 할 수 있는 것 등이다,긍정
박쥐에 기생하는 바이러스가 사향고양이나 족제비 오소리 등에 옮겨져 이를 파는 수산물 시장에서 인간에게 전염됐으리란 것이다,긍정
a부터 빅데이터바이오까지 푸드테크 기술을 적용하면 개개인의 상황별 수요에 맞는 맞춤형 식품 서비스가 일상화할 수 있기 때문이다,긍정
안용복이 귀국해 조정에 그간의 사정을 알리자 나라에서는 상을 내리기는커녕 어이없게도 다른 나라 국경에 침범해 분쟁을 야기시켰다는 죄목으로 참형에 처하려 했다,긍정
특별연장근로 인가 기준에 모호함이 있어 구체적인 상황에 적용할 때 인가 요건에 해당하는지 논란이 발생할 여지가 있기 때문이다,긍정
a1 a 레이더의 a은 진동충격 및 고온저온 시험 등 전투기체계에서 요구하는 환경시험을 모두 수행해 높은 신뢰성을 확보를 위해 국내 최초로 질화갈륨 기반 소재를 적용해 크기는 작지만 고출력 성능을 가져 레이더 효율성을 크게 향상시켰다,긍정
조선 제1대 왕 태종 이방원의 오른팔 하륜 11은 젊은 시절 여자 문제로 곤경에 빠진 적이 있다,긍정
중국 전국인민정치협상회의정협 외사위원회 부주임차관급인 한팡밍 회장이 이끌고 지한파 연구원들이 많이 포진해 한중 민간교류협력을 강조해 온 민간기구다,긍정
일례로 서울 서초구 반포리체 전용 1는 지난 1월 1억1만원에 거래됐다,긍정
입원 중인 위중증 환자는 어제보다 1명 줄어 1명이다,긍정
흉년이 들었을 때 부유한 사람에게 농민을 구제하기 위한 곡식재물을 내놓거나 직접 나눠주도록 권하는 일을 뜻한다,긍정
최근 코로나1 사태로 인해 면역력의 중요성이 부각되면서 건강기능식품에 관심을 보이는 소비자가 늘자 성장세가 지속될 확률이 높다는 전망이 나온다,긍정
극지법은 본거지를 정한 다음 하나씩 하나씩 전진기지를 만들어가며 목적지에 도달하는 방법이다,긍정
이날 조 교육감은 성찰 교육의 본질 회복 미래 지향 등 세 가지 관점을 키워드로 잡아 혁신교육 11 시대를 열겠다고 강조했다,긍정
일산신도시 아파트 대부분은 11년 사이에 준공돼 재건축 연한1년을 채웠다,긍정
유종하 교수는 적혈구와 백혈구 수치가 올라가면 혈액 점도가 높아지게 되는데 이 때문에 혈류 이상 및 혈관 손상을 유발하는 염증물질이 분비될 수 있다 평상시 혈액세포성분인 적혈구 백혈구 혈소판이 정상범위에 유지되도록 유해 요소에 노출되지 않도록 주의하고 주기적인 혈액 검사를 통한 혈액 질환의 조기 발견도 중요하다고 강조했다,긍정
이에 김기창 교수는 자신의 a사회관계망서비스에 김웅 씨가 검사 그만두시면서 국회가 결정한 검찰제도 개혁을 사기극이라고 평하셨다는데라며 본인께서 검사직에 있는 동안 윤석열과 동료 검사들이 1개월 넘게 저지르고 있는 망나니짓에 대해서는 입도 뻥긋 못한 a가 씨a 소리는 아니지라고 강한 어조로 비판했다,긍정
경찰 관계자는 이번 압수수색은 백현지구 개발사업 특혜 의혹 고발과 감사원 수사 의뢰에 따른 것이라면서 수사 중인 사안이라 자세한 내용은 말해줄 수 없다고 밝혔다,긍정
네이버는 자사의 콘텐츠 플랫폼과 모하우스 간 시너지도 기대하고 있다,긍정
차량의 실핏줄에 해당되다 보니 박스로 포장해 쌓으면 차체보다 부피가 크다,긍정
반대로 주문이 떨어지면 향후 경기를 비관한다는 뜻이다,긍정
11세기 대도시가 발당하면서 개인이라는 개념이 등장했다,긍정
바다의 물결은 동해 앞바다 1111 서해 앞바다 1111 남해 앞바다 1111로 안쪽 먼바다해안선에서 약 1 내의 먼바다의 파고는 동해서해남해 1111로 예상된다,긍정
같은 코스에서 유러피언투어로 열린 남자 빅오픈에서는 a 스타 이민지 동생으로 더 잘 알려진 호주 동포 이민우가 우승했다,긍정
이밖에도 한경연은 상속세 과세방식인 유산세형이 납세자의 부담능력에 따라 조세를 부과해야 한다는 응능부담원칙에 위배되기 때문에 유산취득세 방식으로 전환해야 한다고 주장했다,긍정
청나라 사신은 여인을 얼굴을 본 뒤 조선에는 예쁜 여자들이 많다고 들었는데 참으로 그렇구나라고 감탄했다,긍정
공모작 제출은 1월 1일까지로 대한민국에 거주하는 개인 그룹 법인 모두 참가할 수 있다,긍정
이 교수는 지난 1일 오후 1시께 진해군항 인근 묘박지에서 검역 등 절차를 거친 뒤 이날 오전 1시 1분께 진해군항을 통해 귀국했다,긍정
총선 공천과 지역구 획정의 계절인 요즘 불현듯 떠오른 한 가지 질문이 있다,긍정
지난해 1월 말 기준 라임계열 펀드의 은행 판매액은 우리은행 1억원 신한은행 1억원 하나은행 1억원 등이다,긍정
특출난 영재보다는 평균이 높은 범재들만 키워내고 있는 것이다,긍정
북방의 1군 1진을 개척해 한반도 국경을 확정 지은 최윤덕 11은 무장으로서 좌의정에 오른 입지전적 인물이다,긍정
최근 미국 연방준비제도a가 금리를 단번에 11포인트 높이는 자이언트스텝을 밟으면서 한국은행 금리 인상 가능성도 더 커졌기 때문이다,긍정
뉴욕타임스a는 이번 주 회의에서 1년 이후 가장 큰 금리 인상을 논의할 것으로 보인다고 전했고 a도 11포인트 인상 움직임의 가능성이 있다고 예측했다,긍정
병원으로 이송된 a군은 두개골 골절 외상성 경막하혈종 등을 진단받고 한달여 동안 치료를 받다 생후 1일쯤인 지난 1월 사망했다,긍정
점점 늘어만 가는 의료비가 국가적 재난으로 대두될 것이라는 우려의 목소리가 높아져가고 있다,긍정
정비 업계에 따르면 서울 영등포구 당산동1가 당산현대1차 아파트는 최근 재건축 예비안전진단 접수를 위한 동의서 징구를 완료했다,긍정
생긴 게 거인 발자국 같아 또 다른 전설 스토리가 오르는 지점이기도 하다,긍정
선거철에 정당과 정치인들이 움직이는 것처럼 평소에도 유권자의 마음을 얻기 위해 움직이면 얼마나 좋을까,긍정
그는 대체로 말이 병에 걸리는 것은 사람과 다름이 없다 나는 눈을 가지고 눈을 고치므로 백 번 약을 써도 낫지 않는 적이 없다 제비는 항상 하늘을 날아다니면서 온갖 벌레를 잡아 먹이로 한다 벌레의 살은 소화가 되지만 눈은 소화가 안 되고 변에 섞여 나온다 제비 똥을 많이 구하여 냇물에 일면 더러운 찌꺼기는 모두 없어지고 눈만 남는데 하루에 얻는 양이라고 해봐야 극소량이다 이를 갈아 약에 타서 앓는 눈에 넣으면 자연히 신묘한 효과가 있다 하였다,긍정
곽 의원은 또 조 전 수석 일가에게 선물처럼 쏟아진 검찰소환 특혜 압수수색 특혜 조사 특혜 구속영장 특혜 등 온갖 특혜를 누렸다며 그것도 모자라 공수처가 어서 생겨 검찰을 몰아내고 궁지에 몰린 자신을 구해주길 바란다고 비난했다,긍정
이날 봉준호 감독은 각본상 수상으로 한국 최초 아카데미 트로피를 받았다,긍정
공민왕은 자신의 얼굴도 자주 화폭에 담았다,긍정
때문에 넥슨이 블록체인 생태계의 기축 통화로 넥스트메소를 쓰는 것 아니겠냐는 추측이 나온다,긍정
1일 롯데쇼핑에 따르면 최근 일주일1월 11일간 온라인 매출이 지난해 설 기간1년 1월 11일 대비 최고 1 늘었다,긍정
간밤 미국 연방준비제도a연준가 연방공개시장위원회a에서 기준금리를 한 번에 11포인트 올리는 자이언트 스텝 결정을 내린 1일 오전 1시 서울 명동 은행회관에서 재정통화금융당국 수장들은 비상 거시경제금융회의를 열었다,긍정
홍윤성은 땅을 주면 그렇게 하겠다고 했다,긍정
이 때문에 대국민 기생충퇴치사업을 위해 1년 한국기생충박멸협회가 창립됐고 정부와 협회의 노력으로 1년대 감염률이 1까지 낮아졌다,긍정
게다가 대주주가 대량 매도하며 주가가 고점을 찍었다는 신호로 해석됐다,긍정
현재 북미 수입은 약 1만달러다,긍정
아침 일찍 일어나는 새처럼 미리 준비해두는 몇 가지는 짧고 번잡스러운 여정을 한결 쾌적하고 산뜻하게 만들 수 있다,긍정
물론 그 일로 인해 소비자가 우롱당하고 조롱 당하는 경우도 생기니 문제지만 각설하고 라이크 커머스는 지금 물건을 팔려고 하는 이들이 가장 살펴보아야 할 최전선의 트렌드임은 부정할 수 없는 사실이다,긍정
1차 사건은 1년 1월 1일 화성 태안읍 진안리 박모당시 1세 양의 집에서 박 양이 성폭행당하고 숨진 채 발견된 사건으로 당시 범인으로 검거된 윤모1 씨는 1년을 복역했다,긍정
중국 대표팀이 참가하면서 부산시와 대회 조직위원회 측은 특별 관리에 집중할 예정이다,긍정
요즘 옥연정사는 a세대들 사이에서 취향저격 치유여행지로 통한다,긍정
그 과정에서 정상 부분에서는 쥐어 짠 듯한 모습의 바위들이 서로 엉겨 붙어 있는 모습을 하게 된 것일까,긍정
이에 따라 a1도 최근 등장한 중국산 흥행작 반열에 오를지도 관심사다,긍정
그는 한국에서 좋은 게임을 찾아 갈라게임즈를 통해 퍼블리싱하는 업무의 우선 순위가 회사 내에서도 매우 높다며 적극적인 지원 의사를 표명했다,긍정
그러면서 이슬람교도들의 경우 고환을 따뜻하게 해주는 것이 유일한 보양법이라고 강조한다,긍정
입궁한 엄 씨는 왕의 총애를 독차지하고 정사에 간여해 뇌물 챙기기에 급급했으니 그 정도가 명성황후 못지않았다,긍정
가시적인 성과도 나왔다,긍정
방법은 한자로 적은 이름 사진 소지품 1가지만 있으면 사람을 죽일 수 있는 저주 능력을 의미한다,긍정
댓글을 보니 죽어야 할 것 같았다 그 사람들 이야기를 보면 나는 괴물이었다며 자신도 극단적 선택을 생각하기도 했다고 고백했다,긍정
표만 노리는 정치 욕심과 선거 격랑에 휘말리면 가뜩이나 중산층이 줄어든 한국호는 위험해진다,긍정
최대 1명의 이용자가 함께 전투부대를 구성해 임무를 수행하거나 1명으로 구성된 클랜을 만들어 파벌 분쟁에 참여할 수 있다,긍정
성지 역사박물관은 1년 개관했다,긍정
엽산은 태아의 뇌 발달을 돕고 척추의 신경손상을 막아 선천적 결함을 예방한다,긍정
날씨가 더워질수록 왕성하게 분비되는 땀과 피지로 떡진 머리와 정수리 냄새를 신경 써야 한다,긍정
통합형 금융서비스 확산에 박차를 가하는 것이다,긍정
스토리 북과 같은 게임 속 이야기들을 모아놓을 수 있는 시스템도 기획한다,긍정
원이멀스는 러커a과 협업해 보유 중인 인기 a게임을 추가적으로 공급하고 중국 a시장 공략에 적극적으로 나선다는 계획이다,긍정
일주일 전인 1월 1일 11였던 a는 1월 1일 11까지 치솟았다,긍정
사회적으로 공익성을 가지며 의미가 있는 것일수록 좋다,긍정
개는 사람보다 11도 체온이 높고 몸에 땀구멍이 없어 여름철 무더위에 취약한 점을 고려했다,긍정
특히 흥선대원군과 그의 충복들은 모든 관직과 서훈을 높은 값으로 매매했다,긍정
전문가들은 여러 원인이 복합적으로 작용하며 최근 부동산 하락장을 이끌었다고 분석한다,긍정
지난달 우리나라 외환보유고가 또다시 사상 최대치를 갈아치웠다,긍정
상당수 경쟁사가 연 1에 이르는 고금리로 부도 절벽에 몰렸다,긍정
영화드라마 부문 남우주연상은 국내에서도 1만명 넘는 관객이 본 조커의 호아킨 피닉스가 여우주연상은 주디의 러네이 젤위거가 받았다,긍정
출발 전 그는 노조와의 갈등 해법을 묻는 기자들의 질문에 제가 잘 듣고 말씀 나누도록 하겠다고 답했다,긍정
하지만 해당 가격은 마스크 대란이 터졌던 1년대 초반과 동일한 가격이다,긍정
코로나1발 전대미문의 복합위기가 불어닥치면서 회사채 시장이 실물경제 뇌관으로 지목된다,긍정
정부여당은 파업의 발단인 화물차 안전운임제의 1년 연장을 골자로 한 제도 개편을 곧 논의한다,긍정
aa 개발의 중요성은 동으로는 독도 남으로는 이어도 서로는 격렬비열도까지 영토와 영해를 가진 우리의 주적 개념이 과거 북한에서 이제는 대한민국의 자유와 이념 그리고 주권에 대해서 위협을 가할 의도와 능력을 갖춘 개인 또는 단체로 변경되면서 우리 국민의 생명 및 재산을 위협하는 모든 세력의 도발에 대응하기 위해 주변국 공중전력 이상의 성능을 가진 전투기가 필요하기 때문이다,긍정
바이오및뇌공학과는 올해 카이스트 총장에 부임한 이광형 당시 전산학과 교수가 미래학문 분야 인재양성을 위해 1년 바이오시스템학과로 출발한 학과였다,긍정
이외에도 온라인뿐만 아니라 오프라인에서도 이용자들과 함께 즐기고 소통할 수 있는 특별한 기회를 마련할 방침이다,긍정
수동번호 판매점은 민속촌삼거리 행운복권방용인 기흥구이다,긍정
a하나은행은 서울시 한국주택금융공사와 함께 신혼부부 주거안정 금융지원을 위한 신혼부부 임차보증금 대출을 출시했다고 1일 밝혔다,긍정
김시습은 종에게 밥을 지어서 조우에게 먹이도록 했다,긍정
경쟁작이었던 111점 아이리시맨11점 조커11점 결혼이야기11점보다 더 높았다,긍정
진 전 교수와 유 이사장은 시작부터 격돌했다,긍정
지난 달 1일 미국에서도 처음으로 우한코로나바이러스 환자가 나온 후 하락세로 돌아섰다가 같은 달 1일 애플 실적발표 기대감 속에 1대 증시가 일제히 1선을 오가는 상승세를 기록했는데 지난 1일에는 우량주 중심 다우존스1 산업평균지수11를 비롯해 대형주 중심 스탠더드앤드푸어스aa 1 지수11 기술주 중심 나스닥 지수11가 1이상 빠지며 동반 하락했다,긍정
화랑과 경매사 매출은 위축된 반면 아트페어는 성장세를 보이고 있다,긍정
하지만 어려운 대외 여건에도 1년 연속 무역액 1조달러 달성이라는 쾌거를 이뤘다,긍정
전라도를 제외하고 전국에 온천이 없는 곳이 없다,긍정
경찰은 a씨에 구속영장을 신청했다,긍정
금감원은 1일 분조위를 개최하고 이 같은 내용의 이탈리아 헬스케어 펀드 관련 안건 1건에 대해 하나은행의 손해배상 책임을 인정한다고 발표했다,긍정
1월에는 한화가 사우디아라비아 국방부로부터 약 1조원 규모 방산 수출 계약을 따냈다,긍정
연구진은 a1가 a 복제기의 텔로미어에 결합함을 확인하고 a1가 결합된 텔로미어 구조의 특징을 생물물리화학적으로 분석했다,긍정
그리고 이제 다양성이 조화를 이룬 용산의 모습이 보인다,긍정
농협은 각각 평균임금 대비 1개월치 1개월치를 특별퇴직금으로 지급했다,긍정
모두 물에 뛰어드는 과정에서 둘째 형과 자식 둘을 잃는다,긍정
예쁘장하기는 한데 그래서 뭐라고 묻고 싶어진다,긍정
관객 수 제한에서 자유로워진 대형 공연들의 매진 행렬도 이어졌다,긍정
기생충은 최우수작품상 감독상 미술상이하준 조원우 편집상양진모 각본상봉준호 한진원 최우수 국제영화상 후보에 이름이 올라 시상식 전부터 누리꾼의 이목을 끌었다,긍정
